id,title,selftextscore,num_comments,author,created_utc,url,over_18,edited,spoiler,stickied
g53lxf,"Lad wrote a Python script to download Alexa voice recordings, he didn't expect this email.",0,133,iEslam,2020-04-20 23:11:39,https://i.redd.it/2s0dj8ob12u41.png,False,False,False,False
hoolsm,This post has:,0,435,Krukerfluk,2020-07-10 13:06:13,https://www.reddit.com/r/Python/comments/hoolsm/this_post_has/,False,False,False,False
gftejm,I redesign the Python logo to make it more modern,0,265,jessjwilliamson,2020-05-08 13:39:09,https://i.redd.it/rxezjyf4ojx41.png,False,False,False,False
7kpme8,Automate the boring stuff with python - tinder,0,325,backprop88,2017-12-19 00:47:56,https://gfycat.com/PointlessSimplisticAmericanquarterhorse,False,False,False,False
irh8l0,"I'm excited to share my first published book, Introduction to Python Programming for Business and Social Science Applications -- specifically geared towards students not specifically in computer science",0,249,paulkaefer,2020-09-12 17:53:16,https://i.redd.it/ebmh8z3c8rm51.png,False,False,False,False
gn9add,Drawing Mona Lisa with 256 circles using evolution [Github repo in comments],0,121,Itwist101,2020-05-20 10:58:14,https://v.redd.it/nyzyx7uyfwz41,False,False,False,False
hqc7ol,I made a simulation using Python in which a neural network learns to race,0,212,atqm-,2020-07-13 09:27:37,https://v.redd.it/bgmc6q20ela51,False,False,False,False
ghxqod,"Thanks to everyone’s advice, my mouse drawing algorithm has gotten much better and faster!",0,203,Nekose,2020-05-11 22:14:39,https://v.redd.it/sktc30zom7y41,False,False,False,False
iehths,Debugging Cheat Sheet,0,112,HotTeenBoy,2020-08-22 12:47:04,https://i.redd.it/p1i8awsivji51.jpg,False,False,False,False
dg0etx,Just trying to create a orbit system in python and this happened...,0,360,LAMagicx,2019-10-10 16:21:30,https://v.redd.it/8i70ps8doqr31,False,False,False,False
gbko3e,Dev'ing an app to help visualize data from any matplotlib figure,0,157,professormunchies,2020-05-01 15:54:41,https://gfycat.com/lineartangeese-application-visualizer-visualizar-augmented-data,False,False,False,False
hmoabi,I've designed brand new cheatsheets (x2) and handouts (x3) for matplotlib,0,107,Nicolas-Rougier,2020-07-07 05:10:27,https://raw.githubusercontent.com/matplotlib/cheatsheets/master/cheatsheets-1.png,False,False,False,False
hpr28u,"I am a medical student, and I recently programmed an open-source eye-tracker for brain research",0,194,Sebaron,2020-07-12 08:29:10,https://v.redd.it/tqzx750wzda51,False,False,False,False
7jti46,"MS is considering official Python integration with Excel, and is asking for input",0,395,Chilangosta,2017-12-14 18:24:25,https://i.imgur.com/l2f9Zvb.jpg,False,False,False,False
gzila7,Python 3 in One Pic,0,170,TheInsaneApp,2020-06-09 07:52:27,https://i.redd.it/dixavkhibu351.png,False,False,False,False
f55076,I've made a 3D scanner that's fully automated using Python script on Android phone!,0,88,redditNewUser2017,2020-02-17 07:12:31,https://v.redd.it/n8nsbsq0pfh41,False,False,False,False
ga7y7f,I made a little program that mutes spotify ads because i dont have the money to get premium . Not anything special but i think its quite neat. Any ideas on cool python projects i can build ?,0,343,IMFAILINGENGLISH,2020-04-29 11:46:06,https://i.redd.it/47qqwabpvqv41.png,False,False,False,False
hg9sk8,The only way to satisfy a programmer on his birthday!,0,234,kookeo,2020-06-26 15:34:38,https://i.redd.it/cbz37hmdx9751.jpg,False,False,False,False
e9fgjp,Happy Holidays! Made a user-directed greeting card using Python Turtle Graphics,0,89,Igor_d7,2019-12-11 23:51:02,https://v.redd.it/uo2qj6bed3441,False,False,False,False
cmdbuf,Python's response to MATLAB,0,376,Alexanderdaawesome,2019-08-05 16:38:00,https://i.redd.it/lunmi0varne31.jpg,False,False,False,False
fjqoxv,Laid off for 8 weeks. Anyone else starting their python journey?,0,314,HotSwap_,2020-03-16 19:23:03,https://i.redd.it/uqia9wc853n41.jpg,False,False,False,False
fr5561,[Beginner’s Guide] How to start programming in Python,0,117,MrGrj,2020-03-29 12:26:47,https://i.redd.it/kwubxzttulp41.jpg,False,False,False,False
7mwgtw,Python Cheet Sheet for begineers,0,124,winner_godson,2017-12-29 19:34:05,https://i.redd.it/4iklecheyw601.jpg,False,False,False,False
gs7xdb,A Python GUI for uninstalling the default Windows 10 apps.,0,199,Goldtom,2020-05-28 15:06:43,https://i.redd.it/r51f4jvzti151.png,False,False,False,False
goldxf,"A tool that copies a selected area of your screen, not as a picture, but as pastable text (GitHub in comments)",0,189,PR0T064,2020-05-22 15:26:51,https://v.redd.it/6guhj6h62c051,False,False,False,False
f35yg0,"Python project that answers high-school problems almost instantly. Made using Tesseract, Scrapy and Flask.",0,227,Ani171202,2020-02-13 06:47:33,https://v.redd.it/gvd3q20u0ng41,False,False,False,False
hu4umj,Thought this looked familiar...,0,37,GrizzlyBaird2112,2020-07-19 18:01:40,https://i.redd.it/mfy0xday2ub51.jpg,False,False,False,False
jui7zw,"PrettyErrors, a module to format exception reports",0,167,-sideshow-,2020-11-15 07:36:29,https://raw.githubusercontent.com/onelivesleft/PrettyErrors/master/example.png,False,False,False,False
gvnyx5,Finished a program that draws images with epicycles!,0,147,OutOfTempo_,2020-06-03 05:42:43,https://i.redd.it/2cu4xa8wum251.gif,False,False,False,False
hrvxrd,Python in a nutshell (Had to do it),0,113,Asryk,2020-07-15 20:57:02,https://i.redd.it/o5fhi4uw33b51.jpg,False,False,False,False
er9q4h,I wrote a Python program to play Google Dinosaur Game using Gesture Recognition,0,116,toastyCSboi,2020-01-20 07:05:04,https://v.redd.it/h0i88azauvb41,False,False,False,False
gjlcyp,"I made an AI opponent for lesser known board game - Chain Reaction. Apparently, it plays better than me!",0,170,randBrownGuy,2020-05-14 12:26:00,https://v.redd.it/7dvqal3f4qy41,False,False,False,False
iwt09a,End-to-End Self Driving Car - Need For Speed,0,262,Gautam-j,2020-09-21 03:52:04,https://v.redd.it/48358seyafo51,False,False,False,False
g5bbss,My Professor wants hand written assignments. So I made MyhandWriting.. that can write in myway on a A4 sheet paper.,0,355,bugboy404,2020-04-21 08:16:44,https://v.redd.it/no19vtbyq4u41,False,False,False,False
glzol8,So I made a Python and Arduino project that dynamically changes sets the ambient lighting to match the computed dominant color values from the wallpapers.,0,176,mshoaib9711,2020-05-18 11:26:11,https://v.redd.it/nkrgfihtciz41,False,False,False,False
isbjm4,"I am excited to share my 8th published book, Python 101, geared for beginners and intermediate level readers",0,133,driscollis,2020-09-14 01:48:41,https://i.redd.it/jsla1w1pq0n51.jpg,False,False,False,False
j5a2ih,This great message,0,101,SuperZooper3,2020-10-05 00:47:07,https://i.redd.it/iyb4l795b6r51.png,False,False,False,False
1434dxo,Should r/Python participate in the June 12th Blackout protesting the API changes,0,336,IAmKindOfCreative,2023-06-07 05:29:21,https://www.reddit.com/r/Python/comments/1434dxo/should_rpython_participate_in_the_june_12th/,False,False,False,False
gaqe3d,Made an annoying Python script that sends a friend on Facebook Messenger the Shrek movie word by word,0,272,Sponta7,2020-04-30 06:23:00,https://i.redd.it/04iw5fezewv41.png,False,False,False,False
yyi6xv,The Python Mega Course is now free on Udemy,0,201,Ardit-Sulce,2022-11-18 11:48:22,https://www.reddit.com/r/Python/comments/yyi6xv/the_python_mega_course_is_now_free_on_udemy/,False,False,False,False
ggt5ld,I'm developing a game with Python and Pygame!,0,214,DaFluffyPotato,2020-05-10 02:31:23,https://i.redd.it/jogf31rlmux41.gif,False,False,False,False
izspe0,I made an Instagram Bot to make DeepFakes for everyone! @deepfake.maker,0,139,dome271,2020-09-25 21:42:11,https://v.redd.it/0g28dzoh5dp51,False,False,False,False
i9q4dx,I finished my Python Ray Tracer capable of rendering refraction and thin film interference!,0,106,cenit997,2020-08-14 17:20:14,https://v.redd.it/gtgkdmis3xg51,False,False,False,False
iiamfv,This post has,0,277,None,2020-08-28 16:47:05,https://www.reddit.com/r/Python/comments/iiamfv/this_post_has/,False,False,False,False
h9bfe4,Made a Screen Dimmer based on Facial Recognition with OpenCV and AppleScript!,0,132,LAcuber,2020-06-15 07:34:55,https://v.redd.it/ns6wu0ho11551,False,False,False,False
hnknw0,"A Program that acts as an ""invisibility cloak""... It camouflages any person/object that appears in front of the camera.... Sorry for the colour jittering🙈",0,120,Mayank008,2020-07-08 16:53:43,https://v.redd.it/btu87d6hyn951,False,False,False,False
63dkmq,"We started late, but we managed to leave Python footprint on r/place!",0,75,rubickcz,2017-04-04 11:40:55,https://i.redd.it/t29ko63dwipy.png,False,False,False,False
itzn13,An update on Python 4,0,391,anyfactor,2020-09-16 17:02:08,https://i.redd.it/ayxwpuasjjn51.png,False,False,False,False
e2234a,hashtags,0,112,Williamismijnnaam,2019-11-26 18:26:29,https://i.redd.it/8ss44ve160141.jpg,False,False,False,False
hv2vds,Got my first job as a developer!,0,251,Paradoggs,2020-07-21 07:10:10,https://www.reddit.com/r/Python/comments/hv2vds/got_my_first_job_as_a_developer/,False,False,False,False
j3hq21,Recursively flipping and rotating an image. Python source code in comments!,0,60,rvizzz,2020-10-01 21:28:14,https://v.redd.it/p3l9kd1dwjq51,False,False,False,False
j2ai2r,I released the Code for the Instagram DeepFake Bot!,0,87,dome271,2020-09-29 23:12:54,https://v.redd.it/8yof81xg56q51,False,False,False,False
hb108j,I made a ray tracer that simulates curved spacetime by using Einstein's field equations from general relativity. Here's a black hole!,0,127,jrmiranda,2020-06-17 21:51:40,https://i.redd.it/yrcat3ndkj551.jpg,False,False,False,False
j8kpes,I maDe a sCriPT thAT raNdOMlY cApiTAlIZes lEtTErs iN a SEntENcE,0,195,peterlravn,2020-10-10 13:43:32,https://www.reddit.com/r/Python/comments/j8kpes/i_made_a_script_that_randomly_capitalizes_letters/,False,False,False,False
h7qjw7,Replicating Face Mask Detection - OpenCV and MobileNetV2,0,74,Jaldekoa,2020-06-12 18:44:40,https://i.redd.it/r9phf28hyi451.gif,False,False,False,False
jltffk,I think it’s clear why I chose a Software Engineering career path instead of being an Artist,0,70,Clear_Celebration,2020-11-01 00:37:19,https://i.redd.it/9hswsxs1yiw51.jpg,False,False,False,False
j02ftz,Trying to keep my Jump Rope and AI Skills on point! Made this application using OpenPose. Link to the Medium tutorial and the GitHub Repo in the thread.,0,83,jumper_oj,2020-09-26 08:32:29,https://v.redd.it/e2pr66nkdgp51,False,False,False,False
jii8ex,"I teach Python courses - here's my collection of about 1,000 slides on various Python topics, including data science (hosted on GitHub, licensed under CC-BY-SA)",0,88,marko_knoebl,2020-10-26 16:55:24,https://marko-knoebl.github.io/slides/#python,False,False,False,False
fna798,"Because of quarantine and online clases I made some scripts to automatically connect to my zoom classes to get more sleep, I also configured my Mac to show old recording of me as a virtual cam in zoom so I don't have to attend early classes",0,120,diegoortiz2000,2020-03-23 00:07:20,https://i.redd.it/inog500edbo41.png,False,False,False,False
f7taiy,My python image/GIF glitching library is now on pypi!,0,71,Phantom569,2020-02-22 14:35:57,https://i.redd.it/os82omztkhi41.gif,False,False,False,False
6no8fm,"Python Section at Foyle's, London",0,79,korniko,2017-07-16 19:50:44,https://i.redd.it/4o8d01o5e0az.jpg,False,False,False,False
in1pyu,I made a Spotify ad stopper because I was too poor for Premium. It automatically detects when an ad plays and then restarts Spotify in the background. It's my first project after escaping tutorial hell and I'd love any feedback you guys have!,0,152,soumanony,2020-09-05 14:09:56,https://www.reddit.com/r/Python/comments/in1pyu/i_made_a_spotify_ad_stopper_because_i_was_too/,False,False,False,False
gpaegj,"I was tired of opening 100s of tabs for internship apps. So, I made an app to scrape and apply to every single job listing on Glassdoor with one click using Selenium! (source code and YT video linked below)",0,164,harshi_bar,2020-05-23 18:55:47,https://v.redd.it/mdmvodcz9k051,False,False,False,False
fbavjd,Change text in place with custom hotkeys (Python Keyboard Listener),0,117,dibs45,2020-02-29 10:44:39,https://v.redd.it/g0xfnan4euj41,False,False,False,False
d23ibi,Found this on twitter,0,187,shardul08,2019-09-10 06:01:54,https://i.redd.it/dbmkeewxipl31.jpg,False,False,False,False
d3mvh0,I made a python drawing,0,140,None,2019-09-13 09:48:29,https://v.redd.it/t1ddbj432cm31,False,False,False,False
hvq628,Randomly Generate 69420 - Generate random 5-digit numbers until 69420 is generated,0,263,baranonen,2020-07-22 08:38:44,https://v.redd.it/8lxqrb6tedc51,False,False,False,False
ghab3o,Fourier Series Visualizer in pygame.,0,60,sentient-primate,2020-05-10 21:45:26,https://v.redd.it/lc0tk3knb0y41,False,False,False,False
g2njfz,Hexapod Robot Simulator with only Numpy and Plotly Dash,0,86,mikasarei,2020-04-16 21:00:31,https://v.redd.it/uxfc7gjku8t41,False,False,False,False
hxnyge,I made a project that generates the graph,0,97,None,2020-07-25 14:52:06,https://i.redd.it/x8ueald2o0d51.png,False,False,False,False
jfx7wy,How to quickly remove duplicates from a list?,0,198,sebawitowski,2020-10-22 10:37:23,https://i.redd.it/kppp9jkojmu51.png,False,False,False,False
ndozrt,Why would you want to use BeautifulSoup instead of Selenium?,0,170,Kurisuchina,2021-05-16 14:03:14,https://www.reddit.com/r/Python/comments/ndozrt/why_would_you_want_to_use_beautifulsoup_instead/,False,False,False,False
g7q2ej,My pothole detector. Used yolov3 annotated images on labelimg.,0,141,swallowedlava,2020-04-25 08:20:52,https://i.redd.it/rnpdy79kbxu41.jpg,False,False,False,False
gwdjwr,I made a fractal tree in python using turtle,0,93,Satanic_bumblebee,2020-06-04 08:41:27,https://i.redd.it/l8fryljmvu251.png,False,False,False,False
dmzs6s,I created a python script to generate color palettes from images (info + github link in comments),0,105,R0dartha,2019-10-25 16:21:00,https://i.redd.it/70kl5aweqpu31.jpg,False,False,False,False
7kcjeq,Microsoft Considers Adding Python As an Official Scripting Language in Excel,0,163,amachefe,2017-12-17 07:10:30,https://developers.slashdot.org/story/17/12/15/1133217/microsoft-considers-adding-python-as-an-official-scripting-language-in-excel,False,False,False,False
gyt05b,Snake 4d - 4 spatial dimension game,0,118,Pella86,2020-06-08 05:41:04,https://v.redd.it/ncxxt6azim351,False,False,False,False
qxeyrn,"PrettyErrors, a module to format exception reports",0,80,-sideshow-,2021-11-19 12:14:06,https://raw.githubusercontent.com/onelivesleft/PrettyErrors/master/example.png,False,False,False,False
ld81ic,I created a series in Python that takes you through every detail step-by-step (code included) on how to create your own algorithmic trading bot that trades the financial and crypto markets for free.,0,217,conoroha,2021-02-05 14:18:05,https://www.reddit.com/r/Python/comments/ld81ic/i_created_a_series_in_python_that_takes_you/,False,False,False,False
hx9q9p,A Command Line Stock Dashboard,0,98,jkwill87,2020-07-24 20:45:33,https://i.redd.it/uf086t7davc51.png,False,False,False,False
abjuw4,These two books changed my life in 2018!,0,175,tycooperaow,2019-01-01 17:18:40,https://i.redd.it/dramdluyhu721.jpg,False,False,False,False
hkr6u5,Happy 4th of July from Chicago,0,69,michael_david,2020-07-03 21:19:29,https://i.redd.it/omo1c38dlp851.jpg,False,False,False,False
gf4boc,"I created my first app, ""Timeglass"", a simple, unobtrusive menu bar timer for macOS.",0,96,mountwebs,2020-05-07 10:50:34,https://i.redd.it/nge5pe54pbx41.png,False,False,False,False
nf4jh0,Embedded Python: Build a Game on the BBC micro:bit – Real Python,0,11,pmz,2021-05-18 07:47:45,https://realpython.com/embedded-python/,False,False,False,False
1424s7m,Going dark on 12th June,0,175,iiron3223,2023-06-06 05:21:42,https://www.reddit.com/r/Python/comments/1424s7m/going_dark_on_12th_june/,False,False,False,False
gxsb8v,I created a GUI that collates various interests of mine in one handy place,0,132,Wheeto,2020-06-06 14:49:15,https://i.redd.it/7g7z9qnqya351.jpg,False,False,False,False
i4x5bw,White Cuts Across Black Background - an effect achieved through good use of the Python Image Library,0,56,Swipecat,2020-08-06 18:23:52,https://v.redd.it/nn4a1e4jcff51,False,False,False,False
gizm2t,"With my limited knowledge in Python, I wrote a simple script to control my motorized microscope from a keyboard. All instructions are open-source. Just wanted to share with this community for possible comments and suggestions for further improvements.",0,99,DIY_Maxwell,2020-05-13 14:01:59,https://v.redd.it/b8v3w1nrfjy41,False,False,False,False
arp3z9,Lil cheatsheet,0,140,Slingerhd,2019-02-17 21:10:08,https://i.redd.it/e9he5yt327h21.jpg,False,False,False,False
l1jdcj,"I made a course on NumPy. It got good reviews, but sales were weak so I'm releasing the entire thing for free.",0,134,Neb519,2021-01-20 21:45:27,https://www.reddit.com/r/Python/comments/l1jdcj/i_made_a_course_on_numpy_it_got_good_reviews_but/,False,False,False,False
otbvoj,"Hello, world! I'm Al Sweigart, author of ""Automate the Boring Stuff with Python"" and several other programming books. AMA!",0,533,AlSweigart,2021-07-28 15:11:47,https://www.reddit.com/r/Python/comments/otbvoj/hello_world_im_al_sweigart_author_of_automate_the/,False,False,False,False
go6no5,"Spotlightify - a overlay controller for spotify, allowing you to quickly control your music without distraction. Please let me know if you are interested in this application as I am thinking of making it public on my github in the near future (once more features have been developed), thanks!",0,208,Murpho19,2020-05-21 22:20:40,https://v.redd.it/qy9hkp9307051,False,False,False,False
ejnnbc,I wrote a python script that I'm running on my phone to play a word game called Ruzzle.,0,230,lambda5x5,2020-01-03 23:21:34,https://v.redd.it/q8yf2bhacn841,False,False,False,False
hl2ho5,"Started learning python today, Screw 'Hello World' , I'll start with 'Hello There'",0,185,CROW_98,2020-07-04 12:24:22,https://i.redd.it/wxx1gcbs2u851.png,False,False,False,False
8fztrr,xkcd: Python Environment,0,390,themonsterpus,2018-04-30 14:26:17,https://imgs.xkcd.com/comics/python_environment.png,False,False,False,False
es8dai,"Work laptop doesn't allow minesweeper? I'm gonna build my own minesweeper, with blackjack, and hookers! In fact, forget the hookers!",0,115,Etheo,2020-01-22 06:59:00,https://v.redd.it/43d389uv2ac41,False,False,False,False
l8jvev,"I created a video about Neural Networks that is specifically aimed at Python developers! If you understand the Code, you understand how to create a Neural Network from Scratch! The video took me 200h to create and is fully animated! Hope it helps you guys :)",0,62,Jump2Fly,2021-01-30 11:34:11,https://youtube.com/watch?v=9RN2Wr8xvro&feature=share,False,False,False,False
hei6kg,Wrote a script that downloads r/wallpaper's hottest 100 images and cycles through them as a wallpaper!,0,140,LAcuber,2020-06-23 16:49:50,https://v.redd.it/pxn50vuyvo651,False,False,False,False
l4kpou,"My startup failed, so I open sourced the code. I hope someone finds it useful.",0,118,sn1pr0s,2021-01-25 09:49:52,https://github.com/AdamGold/Dryvo,False,False,False,False
lo6ws0,"Happy birthday, Python, you're 30 years old today: Easy to learn, and the right tool at the right time",0,89,itsaride,2021-02-20 13:14:42,https://www.theregister.com/2021/02/20/happy_birthday_python_youre_30/,False,False,False,False
fgdbxb,I made a Sudoku.com solver using Selenium,0,64,Itwist101,2020-03-10 12:51:44,https://v.redd.it/xxgz2t9ldul41,False,False,False,False
f2jda1,NSA just declassified their python training documents,0,185,Freddykruugs,2020-02-12 01:53:42,https://www.reddit.com/r/Python/comments/f2jda1/nsa_just_declassified_their_python_training/,False,False,False,False
zdpoi4,"at 44, I am struggling on Python for two months now but I keep at it. 2 hours a night, after the kids sleep, I work on it and will eventually be able to use it to get a better job, a better life for them.",0,291,Far-Simple189,2022-12-06 00:33:18,https://www.reddit.com/r/Python/comments/zdpoi4/at_44_i_am_struggling_on_python_for_two_months/,False,False,False,False
ja5y2m,Made this tool with python and my son now hates me,0,195,janusc17,2020-10-13 03:46:43,https://www.reddit.com/r/Python/comments/ja5y2m/made_this_tool_with_python_and_my_son_now_hates_me/,False,False,False,False
gmgezg,"After having this idea a while back and seeing yesterday's post with arduino controlled auto ambient lighting, I creating my own version with python!",0,117,lambda5x5,2020-05-19 03:03:43,https://v.redd.it/m0nqwy6q0nz41,False,False,False,False
ebjgvl,I wrote a program that doodles things in MS Paint!,0,125,AirHamyes,2019-12-16 19:02:56,https://v.redd.it/xiunmzu8jv441,False,False,False,False
koat5n,"Spent 9hrs finding a bug yesterday, took 15mins to figure it out today",0,176,RavenHustlerX,2021-01-01 12:50:31,https://www.reddit.com/r/Python/comments/koat5n/spent_9hrs_finding_a_bug_yesterday_took_15mins_to/,False,False,False,False
dhs74f,When Python Meets Fourier Transform,0,124,vaiv101,2019-10-14 15:31:57,https://v.redd.it/glertp8ryis31,False,False,False,False
npkm6o,It takes a village to build an open-source project and a single a**hole to demotivate everyone,0,191,opensourcecolumbus,2021-06-01 03:26:08,https://www.reddit.com/r/Python/comments/npkm6o/it_takes_a_village_to_build_an_opensource_project/,True,False,False,False
b3oyhl,Made something similar to Apple's Animoji™ using Python,0,70,the_neptunian,2019-03-21 10:36:18,https://v.redd.it/gmp27nnr9gn21,False,False,False,False
f8bn5w,I made a recursive maze solver in Python,0,116,None,2020-02-23 16:25:24,https://v.redd.it/72hqdut09pi41,False,False,False,False
jtdi2e,Python swallows Java to become second-most popular programming language,0,210,None,2020-11-13 08:22:42,https://www.theregister.com/2020/11/12/python_swallows_java_to_become/,False,False,False,False
714kww,Every article about python decorators be like...,0,121,marmaladeontoast,2017-09-19 17:29:14,https://i.redd.it/etmqp95akvmz.jpg,False,False,False,False
g10v5z,I made a python script to download subtitles for your movies...,0,221,sameera__madushan_,2020-04-14 07:08:43,https://i.redd.it/kj5vvd1weqs41.gif,False,False,False,False
exiubj,I'll be damned,0,106,LyricalAlien,2020-02-02 04:21:28,https://i.redd.it/5kfs3x27tfe41.png,False,False,False,False
dvw09b,"BrachioGraph, an ultra-cheap Python-powered drawing machine",0,56,EvilDMP,2019-11-13 18:34:37,https://v.redd.it/w4f0q6tbzhy31,False,False,False,False
lcexoa,I made a Finance Database with over 180.000 tickers to make Investment Decisions easier,0,108,Traditional_Yogurt,2021-02-04 12:49:24,https://www.reddit.com/r/Python/comments/lcexoa/i_made_a_finance_database_with_over_180000/,False,False,False,False
gpqquf,I launched my new website with all my free Python and Machine Learning Tutorials (currently 68).,0,115,python_engineer,2020-05-24 14:41:06,https://www.python-engineer.com/,False,False,False,False
fofxnx,I made my handwriting a font on Inkscape and used custom made python script to add random movment (in y axis) for each character. Looks fine or too suspicious?,0,203,sanidhya69,2020-03-24 23:43:11,https://i.redd.it/qm83ej0yipo41.jpg,False,False,False,False
g78ih1,I wrote a program on python to show how the number of swearwords differs across each breaking bad episode to see if there was any kind of correlation - turns out there isn't and this was a complete flop,0,300,jackpick15,2020-04-24 13:37:32,https://i.redd.it/sx843xk7qru41.png,False,False,False,False
e1ldoz,"A fitting curve that ""boings"" into place (and a digression into spring-mass-dampers, vibration and control theory, and integral transforms)",0,56,Chemomechanics,2019-11-25 19:41:33,https://i.redd.it/tp80yhyrwv041.gif,False,False,False,False
mca9u2,Python made me look like a WIZARD,0,285,None,2021-03-24 16:39:10,https://www.reddit.com/r/Python/comments/mca9u2/python_made_me_look_like_a_wizard/,False,False,False,False
dbg4nm,Rolling Shutter Effect demonstrated with Python,0,59,Swipecat,2019-09-30 18:42:54,https://v.redd.it/fu4wiipo0sp31,False,False,False,False
htkddu,My first major Python project! Made with 100% python using pygame. Source code and download in comments.,0,128,No_One____,2020-07-18 17:25:02,https://v.redd.it/x6thsow5hnb51,False,False,False,False
bsy603,My gravity simulation almost an entire day of work later! Featuring inelastic collisions,0,148,mittwochmensch,2019-05-25 19:02:41,https://i.redd.it/2u3z0tlnne031.gif,False,False,False,False
jogwc5,Stack overflow traffic to questions about selected python packages,0,145,brahim024,2020-11-05 11:01:17,https://i.redd.it/qnfy9xe0lex51.jpg,False,False,False,False
gq8254,"I created ""twenny"" – my very first app! It reminds you to give your eyes a break every 20 minutes to prevent eye strain and is located in your menubar. You can download it on GitHub!",0,163,None,2020-05-25 09:35:02,https://i.redd.it/lw9qnqd4sv051.png,False,False,False,False
fpvay3,Boids - organic motion from 3 simple rules,0,147,None,2020-03-27 11:26:26,https://v.redd.it/n38kfl4q97p41,False,False,False,False
hd6l9t,A VS Code extension that displays the values of variables while you type,0,114,dadadidi,2020-06-21 13:03:00,https://i.redd.it/w432uk9rh9651.gif,False,False,False,False
kqbo85,A new kind of Progress Bar for Python,0,154,rsalmei,2021-01-04 16:08:22,https://www.reddit.com/r/Python/comments/kqbo85/a_new_kind_of_progress_bar_for_python/,False,False,False,False
rra22x,Ever heard of Black? This is the opposite. A tool to turn your clean python code into a hideous (working) mess.,0,181,Gedanke,2021-12-29 14:59:59,https://www.reddit.com/r/Python/comments/rra22x/ever_heard_of_black_this_is_the_opposite_a_tool/,True,False,False,False
