id,title,selftextscore,num_comments,author,created_utc,url,over_18,edited,spoiler,stickied
ftktcn,I made a program that allows you to download song cover arts from Spotify or Soundcloud and then embeds them to your MP3 files.,0,70,sameera__madushan_,2020-04-02 11:36:47,https://i.redd.it/iu1yzg7d5eq41.gif,False,False,False,False
fzwbcx,I made a face recognition program,0,158,ohnice_snub,2020-04-12 12:59:24,https://v.redd.it/63y8wr3axds41,False,False,False,False
fpgq1j,Real Python is giving away a free Python course bundle [access code inside],0,79,dbader,2020-03-26 18:24:13,https://www.reddit.com/r/Python/comments/fpgq1j/real_python_is_giving_away_a_free_python_course/,False,False,False,False
humqci,"I've seen a bunch of Pygame physics simulations here recently, so here's my take on it: accurately modelling the orbits of objects in our solar system using data from JPL Horizons",0,79,f1006,2020-07-20 14:59:03,https://v.redd.it/rhk6wrjjx0c51,False,False,False,False
92tbgy,Found it funny ;),0,151,None,2018-07-29 08:06:09,https://i.redd.it/uafkeky6huc11.jpg,False,False,False,False
jn2xh2,Dear PyGui Now Has Built-in Demo,0,84,Jhchimaira14,2020-11-03 03:25:31,https://i.redd.it/m3qzqnys1yw51.png,False,False,False,False
hfgvsq,I made a hanged man game using turtle library,0,54,None,2020-06-25 06:08:12,https://v.redd.it/wd8q9icdzz651,False,False,False,False
pbbjeo,prettymaps: A small set of Python functions to draw pretty maps from OpenStreetMap data,0,69,ASIC_SP,2021-08-25 13:46:00,https://github.com/marceloprates/prettymaps,False,False,False,False
8cwq72,I made a command-line tool that instantly fetches Stack Overflow results when you get a compiler error,0,72,jsonathan,2018-04-17 14:00:37,https://github.com/shobrook/rebound,False,False,False,False
aa64p6,My nightly ritual.,0,212,timberworks,2018-12-28 02:46:49,https://imgur.com/cQNoNCq,False,False,False,False
eme6k8,[OC] Maze solving algorithm recursively attemps to solve the maze,0,123,Enguzelharf,2020-01-09 19:01:09,https://v.redd.it/y6sn2jskus941,False,False,False,False
oulpdu,Texas Instruments’ new calculator incorporates popular Python programming language,0,106,P4TR10T_03,2021-07-30 14:30:15,https://www.dallasnews.com/business/local-companies/2021/07/29/texas-instruments-new-calculator-incorporates-popular-python-programming-language/,False,False,False,False
n0aitm,The most copied comment in Stack Overflow is on how to resize figures in matplotlib,0,175,jackjackk0,2021-04-28 08:54:46,https://stackoverflow.blog/2021/04/19/how-often-do-people-actually-copy-and-paste-from-stack-overflow-now-we-know/,False,False,False,False
jj6d01,"I wrote a beginner's book about Python. Pay what you like, or nothing.",0,37,jgw25,2020-10-27 18:07:37,https://www.reddit.com/r/Python/comments/jj6d01/i_wrote_a_beginners_book_about_python_pay_what/,False,False,False,False
i1w03b,"""Automate the Boring Stuff with Python"" online course is free to sign up for the next few days with code",0,84,AlSweigart,2020-08-01 17:30:07,https://www.reddit.com/r/Python/comments/i1w03b/automate_the_boring_stuff_with_python_online/,False,False,False,False
e0xm0t,I cross-stitched the Python logo!,0,36,woberto,2019-11-24 11:53:39,https://i.redd.it/9aa9g032im041.jpg,False,False,False,False
my1m66,"Stop hardcoding and start using config files instead, it takes very little effort with configparser",0,324,tc8219,2021-04-25 05:24:35,https://www.reddit.com/r/Python/comments/my1m66/stop_hardcoding_and_start_using_config_files/,False,False,False,False
eolak4,Visualisation of different path finding algorithms,0,73,FearlessENT33,2020-01-14 13:31:05,https://v.redd.it/v03xnbxwxqa41,False,False,False,False
845epf,Python surpasses C# in popularity among developers,0,171,Jedicode,2018-03-13 16:19:21,https://insights.stackoverflow.com/survey/2018/#technology-programming-scripting-and-markup-languages,False,False,False,False
86ufrf,A path finder i recently made in Python PyGame,0,111,boijunior,2018-03-24 17:16:44,https://i.redd.it/ax3q93ikvqn01.gif,False,False,False,False
118ynyy,"Spent Months Writing A Web Dev Course For A Platform, But It Got Canceled Midway. Publishing It Free For The Community.",0,90,appinv,2023-02-22 13:26:14,https://leanpub.com/c/flask-masterclass,False,False,False,False
mcs1kj,"Google Translate, but for Sign Language - I used Python and OpenCV AI Kit to perform Sign Language Detection.",0,52,AugmentedStartups,2021-03-25 06:48:55,https://youtu.be/2fXJe9YqXgU,False,False,False,False
8h512c,Just finished my graduation cap for tomorrow,0,114,AecorUmbra,2018-05-05 03:52:38,https://i.redd.it/ukzmzc7bmyv01.jpg,False,False,False,False
lfuy5e,I wrote a song about everyone's favorite Python Enhancement Proposal,0,109,tastes-like-lemon,2021-02-09 04:52:07,https://www.youtube.com/watch?v=hgI0p1zf31k,False,False,False,False
9t3ko5,My Halloween Facepaint - Scary huh?,0,82,crevan_the_fox,2018-10-31 22:19:43,https://i.redd.it/ezjourczilv11.png,False,False,False,False
cg1ipy,"Physics simulator with rotation and collision I made with Python. If you dropped your phone, and it just kept bouncing!",0,65,mbecks,2019-07-21 17:24:43,https://v.redd.it/8qy69vazxob31,False,False,False,False
bx9rrz,Win10 is going to start including Python 3.7,0,175,thegunn,2019-06-05 23:54:11,https://blog.adafruit.com/2019/06/04/new-guide-python-is-in-the-latest-build-of-windows-10-adafruitlearningsystem-python-adafruit-win10-windows-adafruit/,False,False,False,False
ha5901,Developed a 'personal home assistant' whatsapp bot to control an appliance (lamp in this case),0,76,iamb1izzy,2020-06-16 14:39:31,https://v.redd.it/x9damwy5aa551,False,False,False,False
fio4x4,I am just a beginner in programming. Today I have created my first ever project (Simple Calculator) with Python GUI Tkinter. Thank you for this great community for inspiring me so much.,0,92,Deva161,2020-03-14 19:38:32,https://i.redd.it/0aqf9qi2xom41.png,False,False,False,False
gyf7on,Training a neural net on 7 years of text messages became surprisingly self aware,0,83,onesmallserving,2020-06-07 16:16:41,https://i.redd.it/qit4n4nlji351.png,False,False,False,False
jjpd77,"Out of curiosity, how many of you guys started your journey with 'Automate the boring stuff'?",0,331,Friendly_Signature,2020-10-28 15:02:11,https://www.reddit.com/r/Python/comments/jjpd77/out_of_curiosity_how_many_of_you_guys_started/,False,False,False,False
odhbql,"New search engine made with Python that's anonymous and has no ads or tracking. It tries to fight spam, and gives you control of how you view search results. You can search and read content anonymously with a proxied reader view. The alpha is live and free for anyone to use at lazyweb.ai",0,213,lazy-jem,2021-07-04 09:53:34,https://www.reddit.com/r/Python/comments/odhbql/new_search_engine_made_with_python_thats/,False,False,False,False
k2kbs4,"""Sillynium"" - Auto generate working Python Selenium scripts by drawing coloured rectangles around web elements on a page that you want to automate",0,174,None,2020-11-28 08:38:01,https://www.reddit.com/r/Python/comments/k2kbs4/sillynium_auto_generate_working_python_selenium/,False,False,False,False
c7a5lq,A terminal youtube playlist music player - because terminal applications are minimal and running a web browser is an overkill to listen to music,0,150,TimeTraveller-San,2019-06-30 06:44:38,https://i.redd.it/yqkfcr3mwf731.png,False,False,False,False
vfsakl,"Today I’m releasing PyBoy v1.5.0! A Game Boy emulator written in Python, focused on scripting, AI and learning",0,32,baekalfen,2022-06-19 10:30:13,https://www.reddit.com/r/Python/comments/vfsakl/today_im_releasing_pyboy_v150_a_game_boy_emulator/,False,False,False,False
9xbq05,Flask app to extract palette of dominating colors from image,0,88,main_aisa_kyun_hoon,2018-11-15 14:38:44,https://i.redd.it/h4yzvy8w8iy11.png,False,False,False,False
cpmll6,Made a racing game that runs in Terminal. 100% Python,0,62,high_achiever_dog,2019-08-13 02:19:07,https://i.redd.it/li1r9j4nl4g31.gif,False,False,False,False
9xxuus,Python in the new NASA going to the Moon video.,0,241,Dom_G,2018-11-17 16:50:57,https://i.imgur.com/GxrMHQl.jpg,False,False,False,False
cghqy0,For those of you made uncomfortable by yesterdays simulation. No phones were harmed in the making of this simulation,0,69,mbecks,2019-07-22 19:27:40,https://v.redd.it/em76zkj2pwb31,False,False,False,False
feg8ua,Prof. Gilbert Strang a mathematician and professor at MIT mentioning Python while teaching a course on Computational Science and Engineering in Fall 2008,0,113,abbaadmasri,2020-03-06 16:49:32,https://i.redd.it/5xr7emroz2l41.jpg,False,False,False,False
ctdgk8,I created a python script that can (technically) play videos inside of the terminal!,0,80,epic000,2019-08-21 07:34:54,https://v.redd.it/1322zrdb8rh31,False,False,False,False
grwueh,2D Raycasting along with Rendered view - Visualization was done using Pygame! People who love games would definitely love this! Link to the Github repository in the comments!,0,52,anuj-99,2020-05-28 01:33:03,https://v.redd.it/gm4m2d4qse151,False,False,False,False
ozr7s7,Wrote this program to skip Spotify Ads using Spotify API,0,164,None,2021-08-07 10:58:57,https://www.reddit.com/r/Python/comments/ozr7s7/wrote_this_program_to_skip_spotify_ads_using/,False,False,False,False
xobba8,How I deploy my bootstrapped Python webapp with 150k monthly users,0,169,caspii2,2022-09-26 06:28:54,https://www.reddit.com/r/Python/comments/xobba8/how_i_deploy_my_bootstrapped_python_webapp_with/,False,False,False,False
dij6wi,"My previous post on the algorithm i made to create these images blew up, so here is another! WITH a Github link: https://github.com/TyperOfCode/image_algorithm",0,36,Dirt2Master,2019-10-16 03:08:43,https://i.redd.it/vxh1wfkpkts31.png,False,False,False,False
bc2606,Just Found the Best Python Book...Cover,0,80,domenukk,2019-04-11 16:49:13,https://i.redd.it/rfyhgyfpwnr21.jpg,True,False,False,False
nlavn7,Python is now the second most popular language in the world according to TIOBE. This is the highest position that Python reaches since 2001.,0,186,ivaylos,2021-05-26 07:19:41,https://www.tiobe.com/tiobe-index/,False,False,False,False
hd0ueq,Here's a very simple Python wallpaper,0,48,kr-n-s,2020-06-21 04:42:02,https://i.redd.it/szncuech07651.png,False,False,False,False
i2rofw,I Made Snakes With Neural Networks! Here were the four best ones.,0,58,Arranging,2020-08-03 05:54:05,https://v.redd.it/vzkkak698qe51,False,False,False,False
z3gntf,Detailed Python developer roadmap,0,62,Party_Entrepreneur72,2022-11-24 10:34:46,https://www.reddit.com/r/Python/comments/z3gntf/detailed_python_developer_roadmap/,False,False,False,False
ajdpf2,Simulated herbivores and carnivores on an island using Python,0,97,JorgeJorgeJorgeJorge,2019-01-24 15:49:14,https://v.redd.it/pjgvxwx86ec21,False,False,False,False
ei0hjq,Today is the last day of Python 2 support!,0,253,reJectedeuw,2019-12-31 09:03:33,https://www.reddit.com/r/Python/comments/ei0hjq/today_is_the_last_day_of_python_2_support/,False,False,False,False
62q2sm,Python Helped me Write Again,0,85,irrco,2017-04-01 02:39:39,https://www.reddit.com/r/Python/comments/62q2sm/python_helped_me_write_again/,False,False,False,False
fqdnjv,I made a python script to download and save your favorite Facebook videos.,0,102,sameera__madushan_,2020-03-28 04:53:29,https://i.redd.it/suixxhhwgcp41.gif,False,False,False,False
hj0vp6,My Python regex ebook with hundreds of examples and exercises is currently free,0,109,ASIC_SP,2020-07-01 01:37:41,https://www.reddit.com/r/Python/comments/hj0vp6/my_python_regex_ebook_with_hundreds_of_examples/,False,False,False,False
fm24jb,Made a fluid simulation for my engineering exams,0,92,Alyx1337,2020-03-20 20:28:55,https://i.redd.it/vcvcxnwk0wn41.gif,False,False,False,False
kvol74,Learn something new about Python every day in less than 1 minute,0,206,jcsongor,2021-01-12 09:40:02,https://www.reddit.com/r/Python/comments/kvol74/learn_something_new_about_python_every_day_in/,False,False,False,False
fr1x65,"*Update* Thank you all for your suggestions on my previous post about Handwriting Synthesis Algorithm, after going through all the comments and ideas you all shared, I have made Handwriting Synthesis v2, please review and suggest any changes/add-ons.",0,68,sanidhya69,2020-03-29 07:17:36,https://i.redd.it/c1vokq0jbkp41.png,False,False,False,False
11fio85,"We are the developers behind pandas, currently preparing for the 2.0 release :) AMA",0,368,phofl93,2023-03-01 21:28:33,https://www.reddit.com/r/Python/comments/11fio85/we_are_the_developers_behind_pandas_currently/,False,False,False,False
rs2utp,A strongly typed dialect of Python is coming. I would like to humbly suggest a name for it.,0,475,escailer,2021-12-30 14:19:11,https://www.reddit.com/r/Python/comments/rs2utp/a_strongly_typed_dialect_of_python_is_coming_i/,False,False,False,False
m8l7ip,The New Switch-Case Statement in Python 3.10,0,235,jamescalam,2021-03-19 16:36:03,https://youtube.com/watch?v=2qJavL-VX9Y&feature=share,False,False,False,False
cc5ch7,I wrote an integrated POS system for my girlfriend's restaurant using tkinter.,0,225,kl31,2019-07-12 03:07:02,https://imgur.com/a/RKeuCva,False,False,False,False
dsxv07,Python passed Java as the second-most popular language on GitHub by repository contributors,0,160,hopemeetme,2019-11-07 13:40:40,https://github.blog/2019-11-06-the-state-of-the-octoverse-2019/,False,False,False,False
jittwt,I recently updated my pandas dataframe GUI so you can easily embed it in your own Flask apps. Here's a quick demo I made. Code linked in comments.,0,71,aschonfe,2020-10-27 03:30:38,https://v.redd.it/7usty7d04kv51,False,False,False,False
ijjppe,I created a library called 'handcalcs': it renders your Python calculations in Latex as though you had written them by hand.,0,59,Last-Farmer-5716,2020-08-30 20:20:48,https://www.reddit.com/r/Python/comments/ijjppe/i_created_a_library_called_handcalcs_it_renders/,False,False,False,False
hf31so,i made a python function that turn numbers into graphical format.,0,88,None,2020-06-24 15:30:48,https://i.redd.it/bqsxep4kmv651.png,False,False,False,False
d0ymj4,Tiler - A Tool To Build Images Out Of Other Images (link in comments),0,64,nuno-faria,2019-09-07 17:07:20,https://i.redd.it/x6jmfrile7l31.png,False,False,False,False
wf28ka,A free 'learning map' I found to learn Python. It puts free resources together into a skill tree for planning and tracking learning,0,65,keatonjones_isaloser,2022-08-03 09:43:05,https://app.learney.me/maps/PythonCurriculum,False,False,False,False
fw86w2,Python powered slot car track,0,81,West7780,2020-04-06 22:12:17,https://i.redd.it/158d7mcku9r41.jpg,False,False,False,False
au3ha5,"Animated Dijkstra, sidewinder maze, pillow and imageio (xpost /r/proceduralgeneration",0,81,madducks,2019-02-24 02:51:18,https://i.redd.it/elb13ve8kfi21.gif,False,False,False,False
aglxex,#10YearChallenge,0,96,None,2019-01-16 14:59:05,https://i.redd.it/jqhex9oqusa21.jpg,False,False,False,False
enel78,Sudoku App,0,61,alittleb3ar,2020-01-11 22:40:41,https://i.redd.it/n8aq4ni598a41.gif,False,False,False,False
kdm6o7,The Most Complete List of Legally Free Python Books (Updated 2021),0,72,appinv,2020-12-15 13:58:37,https://www.pythonkitchen.com/legally-free-python-books-list/,False,False,False,False
c91v2r,I created my first neural network that can recognize handwritten digits (Github link in comments),0,77,Fengax,2019-07-04 12:11:00,https://v.redd.it/useogmhn2a831,False,False,False,False
pv4if3,Python just surpassed Java as the 2nd programming language with the highest number of questions in SO.,0,139,katakoria,2021-09-25 10:52:42,https://stackoverflow.com/tags,False,False,False,False
pnie05,Enable ++x and --x expressions in Python,0,83,hx-zero,2021-09-13 16:01:37,https://www.reddit.com/r/Python/comments/pnie05/enable_x_and_x_expressions_in_python/,False,False,False,False
q1dqcv,Python 3.10 Released!,0,147,robd003,2021-10-04 20:01:51,https://www.python.org/downloads/release/python-3100/,False,False,False,False
fh5d7f,"Really simple simulation of virus spreading. Black dots are people, yellow dots are infected (it starts from 1). Each cell visited by an infected can infect other people passing through that for 3 iterations. After 20 iterations a person is infected is deleted from the grid.",0,128,jes_chr,2020-03-11 22:07:24,https://v.redd.it/ujf804w894m41,False,False,False,False
jxobtr,I wrote a Network Packet Sniffer for ethical hacking in Python 3 that exclusively uses built-in libraries.,0,98,EONRaider,2020-11-20 12:41:23,https://www.reddit.com/r/Python/comments/jxobtr/i_wrote_a_network_packet_sniffer_for_ethical/,False,False,False,False
drhez2,I'm a generative artist and currently obsessed with domain warping,0,39,aaronpenne,2019-11-04 13:11:33,https://i.redd.it/55s8ylik5ow31.jpg,False,False,False,False
ariypt,"Just noticed that the code in ""Ralph Breaks the Internet"" is in python",0,88,None,2019-02-17 09:11:27,https://i.redd.it/mzjl2prvh3h21.png,False,False,False,False
fuzxw4,Matplotlib add-on to make Tron-style plots: github.com/dhaitz/mplcyberpunk,0,28,dhaitz,2020-04-04 19:42:48,https://i.redd.it/sa0se1yztuq41.png,False,False,False,False
gqp5jn,Finding the shortest path between two points using the A Star Algorithm! I find it to be one of the best self projects to learn and get into programming. Link to the Github repository in the comments!,0,64,anuj-99,2020-05-26 03:10:53,https://i.redd.it/4frs3yuh01151.png,False,False,False,False
ewtxlo,Achieved what I was trying to do thanks to Reddit.,0,51,AnEmergentAntinomy,2020-01-31 19:57:09,https://i.redd.it/k8kdt9i566e41.gif,False,False,False,False
ciojde,Simulating Quantum Mechanics Using Matplotlib and Tkinter,0,60,--CreativeUsername,2019-07-27 23:26:29,https://gfycat.com/wellgroomedunsteadyballoonfish,False,False,False,False
de92or,Playing Flappy Bird with Mixed Integer Programming,0,34,The_Regent,2019-10-06 20:42:00,https://v.redd.it/rbhk0g98fzq31,False,False,False,False
dyc4ce,I brute forced hello world [Code and Reasons in the comments],0,123,SensibleJames,2019-11-19 00:08:33,https://v.redd.it/jxvwj3kobjz31,False,False,False,False
ks94qq,Today is my first day learning coding and I am awestruck.,0,137,happymoe,2021-01-07 08:33:02,https://www.reddit.com/r/Python/comments/ks94qq/today_is_my_first_day_learning_coding_and_i_am/,False,False,False,False
hcb1zz,The second version of my simple game. It's still pretty pathetic. But now I have implemented a little object orientation (now my code has classes: P).,0,76,M4D4R4G0D,2020-06-19 23:14:04,https://v.redd.it/1vcauplo7y551,False,False,False,False
xykohy,Is it just me or did the creators of the Python QT5 GUI library miss a golden opportunity to call the package QtPy?,0,127,UpAllNate,2022-10-08 05:42:29,https://www.reddit.com/r/Python/comments/xykohy/is_it_just_me_or_did_the_creators_of_the_python/,False,False,False,False
e5i7xp,Cracking like print type,0,250,pyexpert,2019-12-03 14:55:22,https://v.redd.it/ik2nwfqnmf241,False,False,False,False
foukc7,I Used Deep Learning To Identify Naruto (Anime Series) Hand Signs,0,101,oFlamingo,2020-03-25 17:41:58,https://youtu.be/mCcla6k3lXA,False,False,False,False
9h76as,Super Potato Bruh - A game written entirely in Python/Pygame.,0,167,DaFluffyPotato,2018-09-19 17:28:25,https://v.redd.it/tspvwv5sa8n11,False,False,False,False
glikj1,"I made an Android app that detects and recognises traffic signs, using Kivy and OpenCV, to help combat traffic casualties worldwide",0,54,TechnoLenzer,2020-05-17 16:41:22,https://v.redd.it/3opn5k9uscz41,False,False,False,False
hixch7,Made a smart rockets simulation with a genetic algorithm,0,49,None,2020-06-30 22:02:58,https://v.redd.it/gq121gl5e4851,False,False,False,False
hm9pih,I made an automated machine learning bot that can detect diseases using images within seconds,0,95,AnonDoser,2020-07-06 15:28:10,https://i.redd.it/35jinki699951.gif,False,False,False,False
f29iod,"I made an app to watch music videos for the songs playing on your PC, while trying to synchronize them.",0,90,RecklessGeek,2020-02-11 15:03:36,https://gfycat.com/talkativemammothgopher,False,False,False,False
f1qmsj,"Introducing JustPy: An object-oriented, component based, high-level Python Web Framework that requires no front-end programming. With a few lines of only Python code, you can create interactive websites without any JavaScript programming. Comes with a comprehensive tutorial",0,263,eli_mintz,2020-02-10 13:56:34,https://www.reddit.com/r/Python/comments/f1qmsj/introducing_justpy_an_objectoriented_component/,False,False,False,False
cof3mi,Approx 6 months back. I was asking help to practice and learn python in this sub. With the support of this sub yesterday I contributed in one of the DL project of arrow and color detection at the right spot which is to be implemented in self driving rovers. Thank you all.,0,110,bathon,2019-08-10 07:34:06,https://i.redd.it/j10g16s3rkf31.gif,False,False,False,False
8t5ouh,"Python patch, first try.",0,43,shelterin,2018-06-22 23:11:50,https://i.redd.it/w833vgg1xm511.jpg,False,False,False,False
lmnd6w,"I just had a baby, so naturally I had to program a tool for deciphering his schedule",0,90,StPeteTy,2021-02-18 13:59:38,https://www.reddit.com/r/Python/comments/lmnd6w/i_just_had_a_baby_so_naturally_i_had_to_program_a/,False,False,False,False
eg2be8,"I created an AI to play ""Flappy Bird"": my first steps into AI (using Pygame and NEAT-python)",0,70,seppeEnZigie,2019-12-26 22:50:00,https://v.redd.it/ncgt5qrx32741,False,False,False,False
8psk37,TIL that seaborn refuses to use the jet color scheme in a most wonderful fashion,0,92,newcleardrew,2018-06-09 12:44:58,https://i.redd.it/r8t2tazc1z211.jpg,False,False,False,False
ycmnor,Python 3.11 is out! Huzzah!,0,233,GettingBlockered,2022-10-24 21:05:40,https://www.reddit.com/r/Python/comments/ycmnor/python_311_is_out_huzzah/,False,False,False,False
dh2qwd,more than 100 scientific articles may be invalidated because scientists assumed that the output of glob.glob() is sorted,0,346,stefantalpalaru,2019-10-12 23:33:28,https://www.vice.com/en_us/article/zmjwda/a-code-glitch-may-have-caused-errors-in-more-than-100-published-studies,False,False,False,False
i2bqer,"I made a video with 3 projects for beginners. The projects cover game development, web scraping, and automation. All the code is in the description, feel free to play around with it!",0,40,None,2020-08-02 13:05:02,https://www.reddit.com/r/Python/comments/i2bqer/i_made_a_video_with_3_projects_for_beginners_the/,False,False,False,False
57xaud,Python 201 Book is Free for 48 hours,0,293,driscollis,2016-10-17 13:26:35,https://www.reddit.com/r/Python/comments/57xaud/python_201_book_is_free_for_48_hours/,False,False,False,False
izdclm,Automated My Job for the First Time,0,135,BoomerangJack,2020-09-25 04:54:21,https://www.reddit.com/r/Python/comments/izdclm/automated_my_job_for_the_first_time/,False,False,False,False
g0fz1e,Generating a random maze using Prim's algorithm,0,57,mutatedllama,2020-04-13 09:55:15,https://v.redd.it/y9lpy5345ks41,False,False,False,False
nfes13,PyCon US 2021 Notes,0,12,jfischer,2021-05-18 16:13:54,https://www.benedat.com/blog-pycon-1-2021-5/,False,False,False,False
7cffpd,Python Fractal Landscape,0,24,Swipecat,2017-11-12 13:41:55,https://i.redd.it/drnz4ukpsjxz.jpg,False,False,False,False
opb7hm,Do not use mutable objects as default arguments in Python,0,223,None,2021-07-22 10:34:11,https://medium.com/geekculture/do-not-use-objects-as-default-arguments-in-python-1c940212db2e,False,False,False,False
afc6rw,"Alright, which one of you was this? Haha had to stop and take a pic",0,56,iNeverHaveNames,2019-01-12 21:54:48,https://imgur.com/pV1NAH1,False,False,False,False
msbt3p,"Flask 2.0 is coming, please help us test",0,148,stetio,2021-04-16 20:30:39,https://www.reddit.com/r/Python/comments/msbt3p/flask_20_is_coming_please_help_us_test/,False,False,False,False
llccey,16 bytes of Python code compiles to 32 terabytes of bytecode,0,109,azhenley,2021-02-16 20:06:28,https://codegolf.stackexchange.com/a/69415/4270,False,False,False,False
l5ldye,Twitter is opening up its full tweet archive to academic researchers for free,0,111,clcironic,2021-01-26 19:24:13,https://www.reddit.com/r/Python/comments/l5ldye/twitter_is_opening_up_its_full_tweet_archive_to/,False,False,False,False
8ixbcm,A month ago /u/AlSweigart asked for help reviewing his book. I delivered and so did he.,0,41,brainygeek,2018-05-12 16:57:25,https://i.imgur.com/cOCbxbF.jpg,False,False,False,False
8juoum,I made this free tool for practicing Python (it's like Duolingo for learning to code),0,71,memystic,2018-05-16 12:56:49,https://edabit.com/explore?lang=python3,False,False,False,False
gz4nke,"First python project, it's a bit simple but feeling pretty good about it.",0,85,None,2020-06-08 18:17:19,https://v.redd.it/dzwciyjy9q351,False,False,False,False
g1conv,"I made a randomized binary tree (python, tkinter)",0,53,Ro0t-set,2020-04-14 19:58:52,https://v.redd.it/f15osxcr9us41,False,False,False,False
qlnune,I'm sorry r/Python,0,202,MeticMovi,2021-11-03 05:43:33,https://www.reddit.com/r/Python/comments/qlnune/im_sorry_rpython/,False,False,False,False
jgvqa9,The youtube-dl GitHub repo has received a DMCA takedown request from the RIAA,0,198,DerpyChap,2020-10-23 21:02:31,https://github.com/ytdl-org/youtube-dl,False,False,False,False
e3fwo2,I wrote a program to get the high score on a typing practice website,0,99,willlingnesss,2019-11-29 15:10:59,https://v.redd.it/2gqg64dp5n141,False,False,False,False
d45ogl,Rolling Hills (Made with Python Processing),0,34,thebuffed,2019-09-14 14:12:47,https://gfycat.com/groundedthickkentrosaurus,False,False,False,False
xtmxsp,I wrote a Python script which can generate any city from the real world in Minecraft,0,72,louisss-e,2022-10-02 11:55:29,https://www.reddit.com/r/Python/comments/xtmxsp/i_wrote_a_python_script_which_can_generate_any/,False,False,False,False
