id,title,selftextscore,num_comments,author,created_utc,url,over_18,edited,spoiler,stickied
9dpiuu,"Just started Python, felt pretty good to write a script that did my homework for me👌",0,200,spiller10156,2018-09-07 01:38:43,https://i.redd.it/n9ddf4ei0qk11.jpg,False,False,False,False
n3a6ie,"My trailer was stolen late last week, so I wrote a Craigslist scraper so I can see if anyone tries to sell it. (With repo link)",0,59,Absolute_Tinkerer,2021-05-02 16:34:42,https://www.reddit.com/r/Python/comments/n3a6ie/my_trailer_was_stolen_late_last_week_so_i_wrote_a/,False,False,False,False
ifukmz,Free Python for Data Analytics Course,0,84,kreylov,2020-08-24 18:21:25,https://www.reddit.com/r/Python/comments/ifukmz/free_python_for_data_analytics_course/,False,False,False,False
9pu15b,Super Potato Bruh is now on Steam! - Made in pure Python & Pygame - Source code on itch.io!,0,105,DaFluffyPotato,2018-10-20 13:14:00,https://v.redd.it/ga7v0ioqact11,False,False,False,False
1fymy0,"I got a funny error trying to open a file, and decided to illustrate it.",0,47,thegnome54,2013-06-09 02:54:42,http://i.imgur.com/To3DQ6J.jpg,False,False,False,False
bd355n,Created a webapp that displays the bond-line structure of any chemical compound/molecule.,0,53,hvrc23,2019-04-14 14:14:09,https://i.redd.it/mqipsf6tl8s21.png,False,False,False,False
lwpofb,The Self-Taught Programmer (For Python) Udemy Course is Free (I think only for today),0,122,jiejenn,2021-03-03 09:17:51,https://www.reddit.com/r/Python/comments/lwpofb/the_selftaught_programmer_for_python_udemy_course/,False,False,False,False
fjemrj,Made a reaction time game for my first pygame project.,0,56,stndn,2020-03-16 03:52:44,https://i.redd.it/yzat15ofhym41.gif,False,False,False,False
69ws4c,10 awesome features of Python that you can't use because you refuse to upgrade to Python 3,0,293,None,2017-05-08 08:03:38,http://www.asmeurer.com/python3-presentation/slides.html#1,False,False,False,False
gk8jio,"I made a derivative calculator! (For product rule and quotient rule only, as of now). Just started coding and there's still a lot to improve, but I'm so happy with this.",0,67,None,2020-05-15 12:51:40,https://v.redd.it/9kxbcx4fdxy41,False,False,False,False
t7zbbc,An Interactive Cheat Sheet That Just Gives You The Answer,0,81,to_tgo,2022-03-06 14:00:02,https://www.reddit.com/r/Python/comments/t7zbbc/an_interactive_cheat_sheet_that_just_gives_you/,False,False,False,False
b7cy5y,Super Potato Bruh (my Python Indie project) has received a major update!,0,94,DaFluffyPotato,2019-03-30 16:15:08,https://i.redd.it/edmiqi4n6ap21.gif,False,False,False,False
m6a268,10+ Year CS Teacher here. What I'm doing and why I'm doing it,0,88,Tcmancnnr,2021-03-16 14:17:00,https://www.reddit.com/r/Python/comments/m6a268/10_year_cs_teacher_here_what_im_doing_and_why_im/,False,False,False,False
ybf948,"Pyxel, a retro game engine for Python, reaches 300,000 downloads!",0,45,tkitao,2022-10-23 11:25:30,https://www.reddit.com/r/Python/comments/ybf948/pyxel_a_retro_game_engine_for_python_reaches/,False,False,False,False
ajrkh7,EVERY. TIME.,0,144,cybaritic,2019-01-25 17:49:27,https://i.redd.it/15fbl9p8xlc21.png,False,False,False,False
7pid7p,What a surprise: had some Python swag in the mail today!,0,31,onestepinside,2018-01-10 20:16:58,https://i.imgur.com/1Tjtt9h.jpg,False,False,False,False
kfq7iw,Pygame 3D Graphics,0,49,coolmanreebro,2020-12-18 18:04:43,https://www.reddit.com/r/Python/comments/kfq7iw/pygame_3d_graphics/,False,False,False,False
bk287v,"He wasn’t happy about it, but Guido did take a picture with me",0,50,silkydangler,2019-05-03 00:26:53,https://i.redd.it/ean4vo9n4wv21.jpg,False,False,False,False
dnrp3b,Pandas got a new logo,0,72,min2bro,2019-10-27 10:44:52,https://i.redd.it/c6h7rok9c2v31.jpg,False,False,False,False
h02kx4,Made a Tic Tac Toe game.,0,79,None,2020-06-10 03:08:30,https://v.redd.it/26g7dhhe10451,False,False,False,False
jc5xkf,The Ultimate Python Resource hub - Curated list of useful resources for all Python beginners,0,26,cheerfulboy,2020-10-16 08:06:44,https://ayushirawat.com/the-ultimate-python-resource-hub,False,False,False,False
g5gqg0,"I save all of my music on YouTube playlists and was really anoyed by all of the downloaders on the internet(Full of ads, not reliable...). So I've created a simple YouTube playlist downloader, it loads up all of the songs from the playlist and then downloads one by one in a MP4 format.",0,99,ADarkcid,2020-04-21 14:58:19,https://v.redd.it/p5el9ot0n6u41,False,False,False,False
gns9rb,Linear Regression using Gradient Descent (3 types),0,59,Gautam-j,2020-05-21 07:23:19,https://v.redd.it/siwrrt01k2051,False,False,False,False
8w5ra9,A REAL Python cheat sheet for beginners,0,61,Other_Date,2018-07-04 22:56:12,https://learnxinyminutes.com/docs/python3/,False,False,False,False
nrvwuw,Thought I'd make a list of all the best ways to learn Python I found on the net and help the newbies.,0,121,None,2021-06-04 03:52:01,https://www.reddit.com/r/Python/comments/nrvwuw/thought_id_make_a_list_of_all_the_best_ways_to/,False,False,False,False
mi2038,"""Automate the Boring Stuff with Python"" online course is free to sign up for the next few days with code APR2021FREE",0,63,AlSweigart,2021-04-01 18:43:03,https://www.reddit.com/r/Python/comments/mi2038/automate_the_boring_stuff_with_python_online/,False,False,False,False
g8yvzl,I made a python script to get details about a repository just from your terminal before cloning it. All the information are retrieved using the GitHub API.,0,43,sameera__madushan_,2020-04-27 11:19:47,https://i.redd.it/up300faahcv41.gif,False,False,False,False
n5aksy,Tensorflow Object Detection in 5 Hours with Python | Full Course with 3 Projects,0,71,nicknochnack,2021-05-05 07:56:07,https://youtu.be/yqkISICHH-U,False,False,False,False
ddc70w,Updated gravitational potential field simulation. [OC] Link for code: https://github.com/pnp-peeyush/2D-Grvitational-Field-Simulation,0,128,None,2019-10-04 19:30:29,https://v.redd.it/q0vbvoe1tkq31,False,False,False,False
c2w6hc,"Alien invasion game developed using Python. Reference : Python Crash Course, 2nd Edition: A Hands-On, Project-Based Introduction to Programming",0,86,None,2019-06-20 13:43:06,https://v.redd.it/blxwttpyli531,False,False,False,False
oylicw,Python has made my job boring,0,268,tthrivi,2021-08-05 16:04:40,https://www.reddit.com/r/Python/comments/oylicw/python_has_made_my_job_boring/,False,False,False,False
apndyq,Here we go,0,180,TylerJWhit,2019-02-12 00:55:22,https://i.redd.it/sid03mbtc1g21.jpg,False,False,False,False
nabhjm,Wednesday Daily Thread: Beginner questions,0,145,Im__Joseph,2021-05-12 00:00:12,https://www.reddit.com/r/Python/comments/nabhjm/wednesday_daily_thread_beginner_questions/,False,False,False,False
bh9q92,What a journey python had,0,92,gregpr07,2019-04-25 15:07:58,https://v.redd.it/c8g0cvj16eu21,False,False,False,False
y38r6b,"New, free book from Al Sweigart: Python Programming Exercises, Gently Explained",0,88,AlSweigart,2022-10-13 20:14:36,https://www.reddit.com/r/Python/comments/y38r6b/new_free_book_from_al_sweigart_python_programming/,False,False,False,False
ft7n1h,Automate the Boring Stuff with Python Udemy course free to sign up until April 7th.,0,45,AlSweigart,2020-04-01 20:13:14,https://www.reddit.com/r/Python/comments/ft7n1h/automate_the_boring_stuff_with_python_udemy/,False,False,False,False
jb4hb8,Automating Zoom with Python - automatically logs into one's meetings/classes on time,0,75,cheerfulboy,2020-10-14 16:52:28,https://sunilaleti.hashnode.dev/automating-zoom,False,False,False,False
f5vmh6,I've made a sorting visualizer with python and matplotlib.,0,22,lucs_123,2020-02-18 17:47:36,https://v.redd.it/rkzqu9qhzph41,False,False,False,False
5qflfv,"For anyone learning Python for data science, this an amazing resource--excellent book as free Jupyter notebooks",0,35,CataclysmClive,2017-01-27 06:10:21,https://github.com/jakevdp/PythonDataScienceHandbook,False,False,False,False
b63ynr,I made a robot that learns using reinforcement learning in python!,0,68,diddilydiddilyhey,2019-03-27 12:37:53,https://v.redd.it/d9lrrkk4pno21,False,False,False,False
i8ceq4,Python module for Nudity Detection and Classification.,0,144,winchester6788,2020-08-12 11:58:16,https://github.com/notAI-tech/NudeNet,True,False,False,False
c9f3ua,Drawing Replicator using Fourier Transform and Epicycles,0,54,giacomogallina,2019-07-05 11:55:51,https://v.redd.it/dxvknqlssg831,False,False,False,False
113cb77,"Intel Publishes Blazing Fast AVX-512 Sorting Library, Numpy Switching To It For 10~17x Faster Sorts",0,79,fsher,2023-02-15 23:48:51,https://www.phoronix.com/news/Intel-AVX-512-Quicksort-Numpy,False,False,False,False
8yapie,Transfer of Power (Guido stepping down as BDFL),0,473,randlet,2018-07-12 15:24:04,https://www.mail-archive.com/python-committers@python.org/msg05628.html,False,False,False,False
msskzd,[Code Release] We created a fully autonomous YouTube channel that uploads daily self-created Twitch gaming compilations. It was a 100-day experiment that is now over. We spend many hours documenting everything and are sharing our four repositories with this post. Enjoy!,0,43,Jump2Fly,2021-04-17 15:17:10,https://www.reddit.com/r/Python/comments/msskzd/code_release_we_created_a_fully_autonomous/,False,False,False,False
e407b0,My first go at coding neural networks with Python. This is just running a simple training exercise which I'll use later - very excited!,0,108,None,2019-11-30 17:41:11,https://i.imgur.com/wUJIJxr.jpg,False,False,False,False
lhm3pm,Python turns 30 this month😎,0,58,_miku_hatsune,2021-02-11 14:44:28,https://www.reddit.com/r/Python/comments/lhm3pm/python_turns_30_this_month/,False,False,False,False
jz0l14,I made a PlayStation 5 Bot,0,158,Ubershark928,2020-11-22 18:26:34,https://www.reddit.com/r/Python/comments/jz0l14/i_made_a_playstation_5_bot/,False,False,False,False
hjatkm,"I made a Python library for advanced Google News data mining: get news data by topics, geolocation, full-text search. Plus, clusters of similar topics",0,45,kotartemiy,2020-07-01 14:05:35,https://v.redd.it/s3y76ihz59851,False,False,False,False
9pfvll,Made a .jpg to .txt converter,0,96,None,2018-10-19 02:52:46,https://i.redd.it/gn5rqnn042t11.jpg,False,False,False,False
18tn8y0,The Python Mega Course is still free on Udemy,0,166,Ardit-Sulce,2023-12-29 13:34:26,https://www.reddit.com/r/Python/comments/18tn8y0/the_python_mega_course_is_still_free_on_udemy/,False,False,False,False
csb8z5,Layers on layers on layers,0,33,aaronpenne,2019-08-19 03:03:15,https://i.redd.it/4t2qgofmmbh31.png,False,False,False,False
by1l2g,I've been teaching myself python and made a mandelbrot image generator.,0,48,None,2019-06-07 23:50:30,https://i.redd.it/sziiq2b4t0331.png,False,False,False,False
7d128x,NumPy announces timeline for dropping Python 2 support,0,147,vorpalsmith,2017-11-15 02:49:55,https://github.com/numpy/numpy/blob/master/doc/neps/dropping-python2.7-proposal.rst,False,False,False,False
x05859,"Unix Pioneer Brian Kernighan: if you could only use one language, choose Python",0,163,GreyBeardWizard,2022-08-28 20:28:57,https://thenewstack.io/unix-pioneer-brian-kernighan-still-loves-awk-after-all-these-years/,False,False,False,False
rdhqyd,effbot has passed away.,0,52,aroberge,2021-12-10 20:26:21,https://mail.python.org/archives/list/python-dev@python.org/thread/36Q5QBILL3QIFIA3KHNGFBNJQKXKN7SD/,False,False,False,False
bbrhr4,They use python to produce black hole image,0,92,internweb,2019-04-10 21:16:07,https://www.reddit.com/r/Python/comments/bbrhr4/they_use_python_to_produce_black_hole_image/,False,False,False,False
92zezn,The apocalypse,0,140,Deadpixelator,2018-07-30 00:21:19,https://i.redd.it/noqehs16bzc11.jpg,False,False,False,False
e2xi4l,I created this website to visualize how emojis are used on Twitter. Is the 14/4/2016 peak related with Python? Link in comments,0,65,enric94,2019-11-28 12:40:05,https://i.redd.it/t48460q74f141.png,False,False,False,False
kmf1x6,I [13 yo] made a folder automating script in python!!,0,92,ScorpoRio,2020-12-29 14:07:02,https://www.reddit.com/r/Python/comments/kmf1x6/i_13_yo_made_a_folder_automating_script_in_python/,False,False,False,False
b8buj2,I made this figure in python as a masters student and it's still my favorite,0,75,Applied_Mathematics,2019-04-02 00:24:12,https://i.redd.it/2xos31ktvqp21.png,False,False,False,False
d7ma3q,My first own program. Beginner,0,108,Ninjafreak77,2019-09-22 05:29:10,https://i.redd.it/z4u8wq8103o31.png,False,False,False,False
3p12ww,You can hire Guido as a tutor,0,126,danwin,2015-10-16 19:44:30,http://imgur.com/4EPvxJP,False,False,False,False
am0opt,Made use of my Python knowledge professionally for the first time!,0,131,testfire10,2019-02-01 10:23:37,https://www.reddit.com/r/Python/comments/am0opt/made_use_of_my_python_knowledge_professionally/,False,False,False,False
srcg8m,10 Tools I Wish I Knew When I Started Working with Python,0,113,cookedsashimipotato,2022-02-13 06:49:19,https://www.reddit.com/r/Python/comments/srcg8m/10_tools_i_wish_i_knew_when_i_started_working/,False,False,False,False
n9smh1,I wrote another Binance trading algo in Python. This one is able to analyse how volatile every coin on Binance is and place a trade when during a strong bullish movement,0,134,CyberPunkMetalHead,2021-05-11 08:59:04,https://www.reddit.com/r/Python/comments/n9smh1/i_wrote_another_binance_trading_algo_in_python/,False,False,False,False
gstn6b,snakeware - a new Linux Distro with a fully Python userspace,0,115,joshiemoore,2020-05-29 14:07:44,https://www.reddit.com/r/Python/comments/gstn6b/snakeware_a_new_linux_distro_with_a_fully_python/,False,False,False,False
964qci,I wrote a script to display an image in terminal using ANSI codes,0,67,Jonno_FTW,2018-08-10 07:06:33,https://i.imgur.com/gA3fIei.png,False,False,False,False
10525zo,I scanned every package on PyPi and found 57 live AWS keys,0,92,Most-Loss5834,2023-01-06 18:53:40,https://tomforb.es/i-scanned-every-package-on-pypi-and-found-57-live-aws-keys/,False,False,False,False
uznn8f,A modern and customizable python UI-library based on Tkinter,0,50,pipewire,2022-05-28 13:44:47,https://github.com/TomSchimansky/CustomTkinter,False,False,False,False
9zkfk8,This advert for a java course uses an image of python code.,0,72,Shizzle44,2018-11-23 02:52:25,https://i.redd.it/mrb6osbvvzz11.png,False,False,False,False
xajs4w,Been learning Python for a month now and if you are on the fence on learning programming this post is for you.,0,89,siralmasy,2022-09-10 08:15:42,https://www.reddit.com/r/Python/comments/xajs4w/been_learning_python_for_a_month_now_and_if_you/,False,False,False,False
6dtp3d,SMS Spoofing with Python for Good and Evil,0,57,sdurx,2017-05-28 13:07:32,http://www.thedurkweb.com/sms-spoofing-with-python-for-good-and-evil/,False,False,False,False
dzptly,A Python program that lets you set the Windows desktop wallpaper to a video!,0,99,epic000,2019-11-21 20:57:08,https://v.redd.it/hjlmsqmir3041,False,False,False,False
lyg74t,"Complete Python Course (~5 Hours, Free)",0,42,Techworld_with_Nana,2021-03-05 16:55:15,https://www.reddit.com/r/Python/comments/lyg74t/complete_python_course_5_hours_free/,False,False,False,False
xlgo4a,I wrote my first real scripts today,0,117,deltaexdeltatee,2022-09-22 23:18:40,https://www.reddit.com/r/Python/comments/xlgo4a/i_wrote_my_first_real_scripts_today/,False,False,False,False
ur9t92,Python 3.10 Match statements are 86% faster than If statements,0,97,azhenley,2022-05-17 00:08:50,https://twitter.com/anthonypjshaw/status/1526034155448184832?s=21&t=r9ADTOqs_C0DP_RraR97Pg,False,False,False,False
fbq7ej,I wrote a deep RL agent using Python and Tensorflow 2 that can play a perfect game of snake (6x6 grid),0,25,jack-of-some,2020-03-01 06:33:22,https://v.redd.it/4rc2iqw5a0k41,False,False,False,False
ilp6py,Facial Detection with python in just 2 mims [tutorial],0,63,Slingerhd,2020-09-03 07:48:42,https://youtu.be/LdMFdGo6O1E,False,False,False,False
eo3pzd,A* path finding algorithm visualizer written in pygame - https://github.com/mHaisham/Steruell,0,48,mHaisham,2020-01-13 12:52:28,https://v.redd.it/0ybky6bzkja41,False,False,False,False
hy1wxg,Looking for a Python subreddit for non-beginners,0,182,None,2020-07-26 06:12:26,https://www.reddit.com/r/Python/comments/hy1wxg/looking_for_a_python_subreddit_for_nonbeginners/,False,False,False,False
rofw96,You can now make Python desktop apps with HTML and CSS?,0,187,RS1AN,2021-12-25 19:35:28,https://www.reddit.com/r/Python/comments/rofw96/you_can_now_make_python_desktop_apps_with_html/,False,False,False,False
khajql,I made a little script to download playlist from Spotify,0,144,norbeyandresg,2020-12-21 05:01:14,https://www.reddit.com/r/Python/comments/khajql/i_made_a_little_script_to_download_playlist_from/,False,False,False,False
veklmy,Is there possible interest in a youtube series on building a python desktop program?,0,189,panofish,2022-06-17 16:57:08,https://www.reddit.com/r/Python/comments/veklmy/is_there_possible_interest_in_a_youtube_series_on/,False,False,False,False
pnzh50,Datasette Desktop 0.2.0: The annotated release notes,0,9,genericlemon24,2021-09-14 09:35:40,https://simonwillison.net/2021/Sep/13/datasette-desktop-2/,False,False,False,False
cyslju,"AI Cheatsheets - Now learn Tensorflow, Keras, Pytorch, Dask, Pandas, Numpy, Scipy, Pyspark, R Studio, Matplotlib and many more in an interactive manner",0,67,kailashahirwar12,2019-09-02 18:06:06,http://www.aicheatsheets.com/,False,False,False,False
jp0x4d,Taking a dictionary as an argument is the root of all evil,0,242,None,2020-11-06 07:35:14,https://www.reddit.com/r/Python/comments/jp0x4d/taking_a_dictionary_as_an_argument_is_the_root_of/,False,False,False,False
j5731h,A List of 100+ Random Python (beginner and advanced) Project Ideas,0,60,Avi_TheCodex,2020-10-04 21:35:10,https://www.reddit.com/r/Python/comments/j5731h/a_list_of_100_random_python_beginner_and_advanced/,False,False,False,False
7zpn7y,Got some free time this weekend and want to build your Python and machine learning skills? Here's how to train your own object detector using Google's Python-based TensorFlow framework.,0,33,Taxi-guy,2018-02-23 17:14:14,https://www.youtube.com/watch?v=Rgpfk6eYxJA,False,False,False,False
zknjik,An attempt to significantly reduce homelessness and poverty: I made an open source web application that helps people who are struggling find social services and donators in their area that will help them.,0,40,bluemoss_co,2022-12-13 05:30:59,https://www.reddit.com/r/Python/comments/zknjik/an_attempt_to_significantly_reduce_homelessness/,False,False,False,False
flu062,"Inspired on the Washington post article about COVID19 contain curve, I wrote some code emulating it. Comments are welcome.",0,104,elbuenrobe,2020-03-20 12:12:40,https://v.redd.it/3a75rrasjtn41,False,False,False,False
cb1gkd,Created a fun script to poorly replicate any image with Turtle,0,42,None,2019-07-09 14:17:59,https://v.redd.it/d0wkpmgoj7931,False,False,False,False
bscau7,"First upload here, graphic of a path finding algorithm using pygame. Been coding for about 8 months now, thought I'd like to show it off. :)",0,68,chicken_fear,2019-05-24 03:52:04,https://v.redd.it/8rp3i1n603031,False,False,False,False
dx4gd7,"I created the Chaos game theory in python using only PyGame, random and the basics of algebra (I'm 14)",0,189,None,2019-11-16 08:49:03,https://v.redd.it/1cadwao1h0z31,False,False,False,False
h11dsi,A Tkinter Widget Templater/GUI Builder for Python (Linux/Mac),0,60,None,2020-06-11 15:24:16,https://i.redd.it/jb7ooq67sa451.png,False,False,False,False
o52ldp,Does anyone else dislike working with .ipynb files? Why can't I just define code cells with # %%,0,60,UglyChihuahua,2021-06-21 18:58:36,https://www.reddit.com/r/Python/comments/o52ldp/does_anyone_else_dislike_working_with_ipynb_files/,False,False,False,False
lb08fj,"Full Course - Financial Data Analysis with Python - Part 1 of 8 - Technical Analysis with DataFrames - Use DataFrames to load historical stock price data, Similarities with DataFrames and Excel, Learn about loc and iloc on DataFrames",0,40,LearnPythonWithRune,2021-02-02 16:49:46,https://youtu.be/m8ahf_c9hEc,False,False,False,False
eyigdc,Interactive Coronavirus Spreading Map in Python,0,71,m_razali,2020-02-04 02:05:45,https://i.redd.it/8z9urw8fete41.gif,False,False,False,False
q2rpmp,Tkinter for python 3.10 broken on MacOS?,0,44,_seeking_answers,2021-10-06 19:33:57,https://www.reddit.com/r/Python/comments/q2rpmp/tkinter_for_python_310_broken_on_macos/,False,False,False,False
oxoldd,"I was hired partly because of my knowledge of python, but head of IT won’t let me install it…",0,339,TheHostThing,2021-08-04 08:57:52,https://www.reddit.com/r/Python/comments/oxoldd/i_was_hired_partly_because_of_my_knowledge_of/,False,False,False,False
b1h8za,Coding in python sometimes feels like writing a really weird tongue twister...,0,165,vzakharov,2019-03-15 16:52:53,https://i.redd.it/ixl0cj0tbbm21.gif,False,False,False,False
jyi8ku,Better Python console apps with Rich,0,28,pmz,2020-11-21 20:46:11,https://jslvtr.com/posts/better-python-console-apps-with-rich,False,False,False,False
vd6yt2,i mapped the whole C standard library to python,0,94,ZeroIntensity,2022-06-15 22:49:19,https://www.reddit.com/r/Python/comments/vd6yt2/i_mapped_the_whole_c_standard_library_to_python/,False,False,False,False
mk04fg,A horrifying single line neural network using NumPy,0,87,3191hex,2021-04-04 17:00:19,https://www.reddit.com/r/Python/comments/mk04fg/a_horrifying_single_line_neural_network_using/,False,False,False,False
k62xlu,"Using Python and Spotify Web API, you can make an ""endless"" playlist based of the Rolling Stone Magazine's top 500 albums of all time",0,44,ajmonty21,2020-12-03 18:25:50,https://blog.seekwell.io/endless-spotify-playlist,False,False,False,False
5yqgc3,I accidentally deleted some Python source code but it was still resident in a running process - here's how I got it back,0,95,simonw,2017-03-11 02:36:43,https://gist.github.com/simonw/8aa492e59265c1a021f5c5618f9e6b12,False,False,False,False
mikh28,Send SMS Text Message With Python Using GMail SMTP For Free,0,88,acamsoo,2021-04-02 13:33:25,https://www.reddit.com/r/Python/comments/mikh28/send_sms_text_message_with_python_using_gmail/,False,False,False,False
kfwx2l,[Project] carefree-learn: Tabular Datasets ❤️ PyTorch,0,6,carefree0910,2020-12-18 23:59:10,https://www.reddit.com/r/Python/comments/kfwx2l/project_carefreelearn_tabular_datasets_pytorch/,False,False,False,False
f6tjds,I have been learning python as my first language for a few months now and I finally made a project I think is fun and proud enough of to show off.,0,90,thebasementtapes,2020-02-20 14:06:02,https://v.redd.it/4oq69hnp53i41,False,False,False,False
iy48av,I had tried to visualise the sorting of a data structure for the programmers who are new in data structure,0,45,Aaris_Kazi,2020-09-23 05:25:49,https://v.redd.it/4zow9alp1uo51,False,False,False,False
frtg22,Real Python is giving away lifetime access to some of their paid courses for free. Great way to utilize time while in quarantine.,0,22,aabhusanaryal,2020-03-30 16:01:13,https://www.aabhusanaryal.com.np/2020/03/free-realpython-courses.html/,False,False,False,False
eecd17,Python tool to turn images into sound by creating a sound whose spectrogram looks like the image. Motivated by DOOM hiding satanic symbols in its soundtrack. [OC],0,44,Gedanke,2019-12-22 23:52:08,https://gfycat.com/belovedharmfulkudu,False,False,False,False
eke4jy,I like how simple python + pygame is. Less than 60 minutes of playing around with it and I can jump around. The code is a bit messed up...,0,57,rherrmannr,2020-01-05 15:09:45,https://i.redd.it/auadleqs6z841.gif,False,False,False,False
agy027,Python is becoming the world’s most popular coding language,0,222,el_programmer,2019-01-17 13:57:58,https://www.economist.com/graphic-detail/2018/07/26/python-is-becoming-the-worlds-most-popular-coding-language,False,False,False,False
ikliwj,Web Scraping 1010 with Python,0,102,sbskell,2020-09-01 14:43:33,https://www.scrapingbee.com/blog/web-scraping-101-with-python/,False,False,False,False
9tckvc,"I made a dice roller in python. It isn’t much, but it was fun to make :)",0,91,None,2018-11-01 19:24:55,https://v.redd.it/ifd4aoqosrv11,False,False,False,False
nstf0t,"I learnt to use ASTs to patch 100,000s lines of python code",0,88,imaginary_rational,2021-06-05 11:10:10,https://www.reddit.com/r/Python/comments/nstf0t/i_learnt_to_use_asts_to_patch_100000s_lines_of/,False,False,False,False
eslbmr,"I see your minesweeper, but how about minesweeper for your terminal? Link to code in the comments.",0,30,naclmolecule,2020-01-23 00:50:51,https://i.redd.it/k69v8szdefc41.gif,False,False,False,False
928hd9,Python is becoming the world’s most popular coding language,0,183,locoroco77,2018-07-27 02:03:21,https://www.economist.com/graphic-detail/2018/07/26/python-is-becoming-the-worlds-most-popular-coding-language,False,False,False,False
lkwjuq,Java programmer coming to Python for the first time...,0,219,jccrafter9000,2021-02-16 05:11:16,https://www.reddit.com/r/Python/comments/lkwjuq/java_programmer_coming_to_python_for_the_first/,False,False,False,False
dhftb0,Made a genetic algorithm with the task of recreating an image using triangles. Used the pillow library for the image work and the rest was just math :),0,79,Dirt2Master,2019-10-13 20:10:49,https://i.redd.it/r4x8wl7h8ds31.png,False,False,False,False
7a0qe0,boo.py,0,20,nfojones,2017-11-01 02:13:27,https://imgur.com/EjCwNNG,False,False,False,False
8o9k0s,The Google reCaptcha solver bot that I made in action.,0,99,someone1020,2018-06-03 16:12:38,https://youtu.be/YzjsXqnAO8w,False,False,False,False
180lq7i,Corporate IT have banned all versions of python lower than the latest,0,220,will-je-suis,2023-11-21 17:01:37,https://www.reddit.com/r/Python/comments/180lq7i/corporate_it_have_banned_all_versions_of_python/,False,False,False,False
