id,title,selftextscore,num_comments,author,created_utc,url,over_18,edited,spoiler,stickied
lx4tmd,"""Automate the Boring Stuff with Python"" online course is free to sign up for the next few days with code MAR2021FREE",0,39,AlSweigart,2021-03-03 21:27:53,https://www.reddit.com/r/Python/comments/lx4tmd/automate_the_boring_stuff_with_python_online/,False,False,False,False
giuxez,Trained an deep learning model to recognize hand written numbers then made a small GUI to enter my own numbers on the screen,0,49,young_boss27,2020-05-13 08:22:48,https://v.redd.it/pikc45c8shy41,False,False,False,False
x9cf74,Don’t laugh at me! Like this is completely not my lane. I’m from the hood.,0,113,Iceprada,2022-09-08 21:31:21,https://www.reddit.com/r/Python/comments/x9cf74/dont_laugh_at_me_like_this_is_completely_not_my/,False,False,False,False
ntew6a,So I like to eat and I like to code but I dont like full priced items - I built a tool to find all sales at various groceries every day so I know how to plan my meals! Take a look - its open source!,0,86,BrilliantScarcity354,2021-06-06 05:54:41,https://www.reddit.com/r/Python/comments/ntew6a/so_i_like_to_eat_and_i_like_to_code_but_i_dont/,False,False,False,False
ex4fwo,Is it possible to do this with Python?,0,72,itzNobest,2020-02-01 10:46:37,https://i.redd.it/gi81b30yhqd41.png,False,False,False,False
cua7xr,Recoding flappy bird in python with pygame,0,79,PureForWhite,2019-08-23 06:55:14,https://v.redd.it/t5de1quzb5i31,False,False,False,False
b1b23t,I’m really proud of a basic chat system I made!,0,95,AgonisingPeach,2019-03-15 05:43:23,https://i.redd.it/psotvkqf08m21.jpg,False,False,False,False
sg3owy,"What're the cleanest, most beautifully written projects in Github that are worth studying the code?",0,142,kenann7,2022-01-30 07:22:52,https://www.reddit.com/r/Python/comments/sg3owy/whatre_the_cleanest_most_beautifully_written/,False,False,False,False
10zdidm,Why Type Hinting Sucks!,0,292,zurtex,2023-02-11 05:45:59,https://www.reddit.com/r/Python/comments/10zdidm/why_type_hinting_sucks/,False,False,False,False
q5cnnk,"Guido van Rossum ""honored"" as Python becomes #1 most popular programming language on TIOBE ranking, passing C and Java",0,44,GreyBeardWizard,2021-10-10 17:34:29,https://developers.slashdot.org/story/21/10/09/0029238/beating-c-and-java-python-becomes-the-1-most-popular-programming-language-says-tiobe,False,False,False,False
lkca8k,Ladies and gentlemen - switch cases are coming!,0,291,53VY,2021-02-15 11:58:09,https://github.com/gvanrossum/patma/blob/master/README.md#tutorial,False,False,False,False
spxim1,Notebooks suck: change my mind,0,341,theearl99,2022-02-11 11:42:22,https://www.reddit.com/r/Python/comments/spxim1/notebooks_suck_change_my_mind/,False,False,False,False
89b73q,"Aiming to fill skill gaps in AI, Microsoft makes training courses available to the public",0,46,None,2018-04-03 07:38:09,https://www.reddit.com/r/Python/comments/89b73q/aiming_to_fill_skill_gaps_in_ai_microsoft_makes/,False,False,False,False
j6n6wt,Six more quick ways to improve your Python,0,164,SourceryNick,2020-10-07 08:25:21,https://sourcery.ai/blog/explaining-refactorings-4/,False,False,False,False
l6dqvx,"Quickly fetch your WiFi password and if needed, generate a QR code of your WiFi to allow phones to easily connect. Works on macOS and Linux and Windows",0,39,imakethingswhenbored,2021-01-27 20:34:11,https://www.reddit.com/r/Python/comments/l6dqvx/quickly_fetch_your_wifi_password_and_if_needed/,False,False,False,False
jpt7s7,"Play detective on Reddit: Discover political trolls, secret influencers and more",0,46,Anub_Rekhan,2020-11-07 15:59:38,https://i.redd.it/hziik0yzbux51.png,False,False,False,False
nklez0,"Why Python 4.0 might never arrive, according to its creator",0,263,sportifynews,2021-05-25 09:17:16,https://www.tectalk.co/why-python-4-0-might-never-arrive-according-to-its-creator/,False,False,False,False
6hgsqr,Instagram Makes a Smooth Move to Python 3 - The New Stack,0,120,NelsonMinar,2017-06-15 18:10:59,https://thenewstack.io/instagram-makes-smooth-move-python-3/,False,False,False,False
gigyew,Particle physics in Pygame with a view and a basic GUI (menu and plots),0,33,Seitoh,2020-05-12 18:18:41,https://i.redd.it/ekaceopgldy41.gif,False,False,False,False
a1rgaq,"I'm no data scientist, can somebody explain the correlation to me?",0,128,Jaizoo,2018-11-30 10:56:06,https://i.redd.it/pm1qhokf8g121.png,False,False,False,False
kyb9rc,RepostSleuthBot - Now Public,0,73,barrycarey,2021-01-16 03:47:23,https://www.reddit.com/r/Python/comments/kyb9rc/repostsleuthbot_now_public/,False,False,False,False
4hazs4,How I built an entire game and toolchain 100% in Python using PyGame,0,135,Chezni19,2016-05-01 19:37:21,https://www.reddit.com/r/Python/comments/4hazs4/how_i_built_an_entire_game_and_toolchain_100_in/,False,False,False,False
bh90iy,I made a Desktop Application to displays the bond-line structure of any chemical compound/molecule.(inspired by u/hvrc23 's work),0,119,ZyanCarl,2019-04-25 14:04:15,https://i.redd.it/tdj6vud43fu21.jpg,False,False,False,False
lngfnw,I never knew events were THIS powerful - A Python observer pattern tutorial,0,56,ArjanEgges,2021-02-19 13:56:54,https://youtu.be/oNalXg67XEE,False,False,False,False
5jwf41,Python 3.6.0 has now been officially released!,0,94,None,2016-12-23 10:12:04,http://blog.python.org/2016/12/python-360-is-now-available.html,False,False,False,False
11hwppa,I built a chatbot that debugs your Python code better than ChatGPT,0,120,jsonathan,2023-03-04 11:03:25,https://www.reddit.com/r/Python/comments/11hwppa/i_built_a_chatbot_that_debugs_your_python_code/,False,False,False,False
nqcdj6,Python is too nice,0,296,Marvelman3284,2021-06-02 03:34:15,https://www.reddit.com/r/Python/comments/nqcdj6/python_is_too_nice/,False,False,False,False
gdzqwf,I made a YouTube video/playlist to MP3 converter with the ability to suggest and edit MP3 annotations,0,67,dumblechode,2020-05-05 15:24:25,https://v.redd.it/5dt4dzu7syw41,False,False,False,False
f79r89,"When I was learning machine learning for the first time, the exact manner in which convolutional neural networks worked always evaded me, largely because they were only ever explained at an introductory level in tutorials. So, I made an animated video explaining exactly how CNNs work. Hope it helps!",0,43,antaloaalonso,2020-02-21 11:25:41,https://www.youtube.com/watch?v=eyKwPyOqMg4,False,False,False,False
12xrvwz,Is it just me or are the docs for sqlalchemy a f*cking nightmare?,0,174,EntropyGoAway,2023-04-24 18:33:41,https://www.reddit.com/r/Python/comments/12xrvwz/is_it_just_me_or_are_the_docs_for_sqlalchemy_a/,False,False,False,False
18dvsl9,TIL The backend of Meta Threads is built with Python 3.10,0,48,TheMblabla,2023-12-08 20:25:30,https://twitter.com/llanga/status/1676846870520291329,False,False,False,False
mehpp4,"A free HTML version of my book ""Python from the Very Beginning""",0,44,jgw25,2021-03-27 16:55:18,https://www.reddit.com/r/Python/comments/mehpp4/a_free_html_version_of_my_book_python_from_the/,False,False,False,False
fwgtu6,I made a command-line tool to find similar sounding audio files,0,96,iamlocal,2020-04-07 08:25:29,https://v.redd.it/wk1mwhxtvcr41,False,False,False,False
fijxgq,I made a bot for a sudoku game,0,45,None,2020-03-14 15:20:06,https://v.redd.it/hxq9evwvnnm41,False,False,False,False
oz5erv,I created an Excel Add-in to generate Pandas Dataframes right inside Excel,0,48,coding_is_fun123,2021-08-06 12:13:53,https://www.reddit.com/r/Python/comments/oz5erv/i_created_an_excel_addin_to_generate_pandas/,False,False,False,False
iz0agr,Python and FastAI to Qualify at Fall Guys,0,55,Dwigt-Snooot,2020-09-24 16:18:38,https://youtu.be/GS_0ZKzrvk0,False,False,False,False
bwlo4g,I made an augmented reality real time sudoku solver in Python (source code in comments),0,74,dingdongmanjr,2019-06-04 06:50:04,https://www.youtube.com/watch?v=H4L9yENEQbI#youtube,False,False,False,False
uqqseh,Sorting lists in python: sorted() vs sort(),0,32,elediardo,2022-05-16 08:06:12,https://www.reddit.com/r/Python/comments/uqqseh/sorting_lists_in_python_sorted_vs_sort/,False,False,False,False
ijdmca,I made a terminal-based presentation tool with colors and effects!,0,79,vortex_ape,2020-08-30 14:35:10,https://www.reddit.com/r/Python/comments/ijdmca/i_made_a_terminalbased_presentation_tool_with/,False,False,False,False
7v0q88,I've created a debugger which lets you conveniently view the value of every expression,0,111,alexmojaki,2018-02-03 17:37:06,https://imgur.com/gallery/48HqX,False,False,False,False
j90xlr,5 Hidden Python Features You Probably Never Heard Of,0,96,cheerfulboy,2020-10-11 07:12:05,https://miguendes.me/5-hidden-python-features-you-probably-never-heard-of-ckg3iyde202nsdcs1ffom9bxv,False,False,False,False
csnz32,So excited. Left work early to pick it up.,0,159,starfish_warrior,2019-08-19 21:49:16,https://imgur.com/boyrPkw,False,False,False,False
gco5v6,A* Pathfinding on Ipad,0,47,None,2020-05-03 10:08:20,https://v.redd.it/3kyrshiwxiw41,False,False,False,False
f3tdu2,Making a game with pygame library,0,30,rmalcolm1,2020-02-14 15:03:52,https://v.redd.it/zpgbqzojmwg41,False,False,False,False
5jf64k,Top 10 Python libraries of 2016,0,64,thesameoldstories,2016-12-20 19:23:15,https://tryolabs.com/blog/2016/12/20/top-10-python-libraries-of-2016/,False,False,False,False
pzylot,Why does it feel like everyone is trying to play code golf??,0,269,jzaprint,2021-10-02 16:38:58,https://www.reddit.com/r/Python/comments/pzylot/why_does_it_feel_like_everyone_is_trying_to_play/,False,False,False,False
ljghmz,So I Accidentally Made a (Harmless) Virus...,0,138,None,2021-02-14 03:39:44,https://www.reddit.com/r/Python/comments/ljghmz/so_i_accidentally_made_a_harmless_virus/,False,False,False,False
10d6ugv,NiceGUI: Let any browser be the frontend for your Python code,0,156,r-trappe,2023-01-16 06:06:38,https://www.reddit.com/r/Python/comments/10d6ugv/nicegui_let_any_browser_be_the_frontend_for_your/,False,False,False,False
k8g0py,Black Hat Python 2nd Edition,0,55,tiarno,2020-12-07 12:47:25,https://www.reddit.com/r/Python/comments/k8g0py/black_hat_python_2nd_edition/,False,False,False,False
fvvuej,I made a simple translator with an interface using kivy,0,80,Chold_,2020-04-06 09:42:00,https://v.redd.it/12nknkf946r41,False,False,False,False
ww84sv,"I was unhappy with Spotify recommendations, so I used Python+Spotify's API to make more than 1,000. See the bottom from a Streamlit app to find your playlist.",0,42,robert_ritz,2022-08-24 03:02:58,https://www.datafantic.com/what-songs-were-popular-when-i-was-in-high-school/,False,False,False,False
ckpk72,Had open-sourced a small script I wrote and mostly forgot about it. But then this happened and made my day!!!,0,34,SkullTech101,2019-08-01 15:05:47,https://i.redd.it/vy83cl7grud31.png,False,False,False,False
s1oqb7,That time I optimized a Python program by 5000x,0,68,emeryberger,2022-01-11 21:53:52,https://www.reddit.com/r/Python/comments/s1oqb7/that_time_i_optimized_a_python_program_by_5000x/,False,False,False,False
a9o110,Comprehensive Python Cheatsheet,0,50,pizzaburek,2018-12-26 12:00:19,https://gto76.github.io/python-cheatsheet,False,False,False,False
9mftca,Neat 'Python cheat sheet for Data Science' for beginners.,0,42,AnecD,2018-10-08 15:25:41,https://i.redd.it/ahetz5jtbzq11.jpg,False,False,False,False
qbhrqh,Python converts assignment writeups into my handwriting !!!,0,114,Heisenberg_082001,2021-10-19 18:34:42,https://www.reddit.com/r/Python/comments/qbhrqh/python_converts_assignment_writeups_into_my/,False,False,False,False
hjgvcz,"""Automate the Boring Stuff with Python"" online course is free to sign up for the next few days with code JUL2020FREE",0,64,AlSweigart,2020-07-01 19:12:20,https://www.reddit.com/r/Python/comments/hjgvcz/automate_the_boring_stuff_with_python_online/,False,False,False,False
e0duk5,Just found an awesome new plugin for pyinstaller. pip install auto-py-to-exe,0,45,0rphon,2019-11-23 05:53:33,https://i.redd.it/96esb55pkd041.png,False,False,False,False
5sel2v,Python for Algorithmic Trading and Investing tutorial series,0,54,sentdex,2017-02-06 14:41:52,https://www.reddit.com/r/Python/comments/5sel2v/python_for_algorithmic_trading_and_investing/,False,False,False,False
14lfawc,"By community vote, r/Python will Return to a Blackout",0,249,IAmKindOfCreative,2023-06-28 17:16:08,https://www.reddit.com/r/Python/comments/14lfawc/by_community_vote_rpython_will_return_to_a/,False,False,False,False
mnodtq,I turned a Nerf gun into a Call of Duty Warzone controller with Python,0,57,T0X1K01,2021-04-09 19:11:11,https://www.reddit.com/r/Python/comments/mnodtq/i_turned_a_nerf_gun_into_a_call_of_duty_warzone/,False,False,False,False
bot638,Things you're probably not using in Python 3 — but should,0,175,bemmu,2019-05-15 04:13:54,https://datawhatnow.com/things-you-are-probably-not-using-in-python-3-but-should/,False,False,False,False
9wxywk,Wrote some Python for Processing to generate bugs. Source code in comments,0,57,aaronpenne,2018-11-14 07:34:10,https://i.redd.it/kazefqjx19y11.png,False,False,False,False
erx4ae,I made a galactic collision simulation in real time with Vpython,0,31,hexaplaysng,2020-01-21 16:36:46,https://v.redd.it/hceawytct5c41,False,False,False,False
ekurlp,Python 2 will retire from its 20 years of service in April 2020.,0,100,ajknpikachu,2020-01-06 14:23:31,https://www.python.org/psf/press-release/pr20191220/,False,False,False,False
nqvrml,Today i finished my first useful program,0,84,karanzinho,2021-06-02 20:40:24,https://www.reddit.com/r/Python/comments/nqvrml/today_i_finished_my_first_useful_program/,False,False,False,False
9ts367,"I just got a 67k job before I even graduated, all thanks to python.",0,175,EchoBravoEchoOne,2018-11-03 06:46:06,https://www.reddit.com/r/Python/comments/9ts367/i_just_got_a_67k_job_before_i_even_graduated_all/,False,False,False,False
7oz812,[off?] My wife made me a python banner,0,56,george-silva,2018-01-08 15:29:44,https://i.redd.it/evlbb8164v801.jpg,False,False,False,False
l3sdim,pip drops support for Python 2,0,109,ASIC_SP,2021-01-24 04:24:41,https://pip.pypa.io/en/stable/news/#id1,False,False,False,False
kl3cyk,30 years(!) of Python Development Visualized. Amazing!,0,34,prometheussf,2020-12-27 13:04:52,https://www.visualsource.net/repo/github.com/python/cpython,False,False,False,False
nxlji5,New Features in Python 3.10,0,102,jamescalam,2021-06-11 17:32:56,https://youtube.com/watch?v=5-A435hIYio&feature=share,False,False,False,False
anpkle,How to Make a Desktop GUI Application in Python?,0,134,TinaWard,2019-02-06 10:53:10,https://www.reddit.com/r/Python/comments/anpkle/how_to_make_a_desktop_gui_application_in_python/,False,False,False,False
is6et5,Happy 1600000000 seconds since epochs everyone!,0,35,pvkooten,2020-09-13 20:47:01,https://www.reddit.com/r/Python/comments/is6et5/happy_1600000000_seconds_since_epochs_everyone/,False,False,False,False
jkw8tr,Deepnote – a Python notebook with real-time collaboration in the browser. We just opened the platform to the public.,0,49,the21st,2020-10-30 12:57:31,https://deepnote.com/,False,False,False,False
fqnmbt,"*for fun* (3months coding experience, just learning the ropes) I made a simple tkinter GUI that keeps track of your current weed, total grams bought, and total spent, and how much you bought and smoked each day. it exports the data to be viewed in an excel file.",0,93,SolidSoup69,2020-03-28 16:43:33,https://v.redd.it/5vs4nsmtyfp41,False,False,False,False
8wc2vi,"5 rarely mentioned but super useful packages you should know about. Also, one of mine",0,50,dusktreader,2018-07-05 16:58:59,https://www.reddit.com/r/Python/comments/8wc2vi/5_rarely_mentioned_but_super_useful_packages_you/,False,False,False,False
desohg,Automate the Boring Stuff with Python (2nd edition) is coming soon!,0,66,jkibbe,2019-10-08 00:52:01,https://www.reddit.com/r/Python/comments/desohg/automate_the_boring_stuff_with_python_2nd_edition/,False,False,False,False
c67pxe,"First post here, thought you guys might like this. I've been working on an electrical thruster for small satellites for my Master Thesis, counting the ignitions with some Python scripts (+webcam) I wrote. (note the super high-tech hardware setup)",0,122,Jirokoh,2019-06-27 16:36:25,https://i.redd.it/q2qnpy4bfx631.jpg,False,False,False,False
8s07vc,The Ultimate List of Python YouTube Channels,0,41,dbader,2018-06-18 15:06:42,https://realpython.com/python-youtube-channels/,False,False,False,False
mteoc0,I built a web scraper to notify you of cancellations at fully booked campsites in Yellowstone National Park,0,43,Juftin,2021-04-18 15:13:38,https://www.reddit.com/r/Python/comments/mteoc0/i_built_a_web_scraper_to_notify_you_of/,False,False,False,False
ao5dml,Flask has overtaken Django according to the 2018 JetBrains Developer Survey,0,227,pastorhudson,2019-02-07 16:18:51,https://www.jetbrains.com/research/python-developers-survey-2018/,False,False,False,False
9lwk7u,"""Python is becoming the world’s most popular coding language"" via The Economist!",0,349,AnecD,2018-10-06 15:00:28,https://i.redd.it/728jemquxkq11.png,False,False,False,False
pa0a76,"Self taught coders with no degree who landed a good job by working hard, tell me your process.",0,195,Substantial-Meet-422,2021-08-23 13:53:32,https://www.reddit.com/r/Python/comments/pa0a76/self_taught_coders_with_no_degree_who_landed_a/,False,False,False,False
mzinii,Finally switch- case is coming to python.,0,153,electroica,2021-04-27 07:04:56,https://www.reddit.com/r/Python/comments/mzinii/finally_switch_case_is_coming_to_python/,False,False,False,False
haje4i,"Since you guys loved my previous project, here is another one where i used same CNN to control RC car running on Arduino as server and python as client with Rock,Paper,Scissors gestures.",0,35,neoknightz,2020-06-17 03:45:58,https://v.redd.it/kaf1u6ds6e551,False,False,False,False
k8yv7b,I made a script to skip youtube ads!,0,85,reddtoric,2020-12-08 06:06:55,https://www.reddit.com/r/Python/comments/k8yv7b/i_made_a_script_to_skip_youtube_ads/,False,False,False,False
b3dbh6,A little python program I wrote that finds the current song playing on my Spotify account and then uses web scraping to display the lyrics.,0,74,Pappa--Stalin,2019-03-20 15:24:33,https://v.redd.it/gm102tkjkan21,False,False,False,False
4fuywi,"Ubuntu 16.04 LTS released with Python 3.5 as standard, rather than Pyhon 2.7!",0,141,Topper_123,2016-04-21 20:31:14,http://www.ubuntu.com/desktop/developers,False,False,False,False
xe2mzy,Machine Learning from Scratch with Python,0,42,SleekEagle,2022-09-14 13:55:21,https://www.reddit.com/r/Python/comments/xe2mzy/machine_learning_from_scratch_with_python/,False,False,False,False
pqs9au,The most WTF Python code I've ever seen,0,138,enterming,2021-09-18 18:57:32,https://www.reddit.com/r/Python/comments/pqs9au/the_most_wtf_python_code_ive_ever_seen/,False,False,False,False
cq53v4,I made a program that will help you find deep learning AI projects and pre-trained models!,0,45,maxbridgland,2019-08-14 05:10:21,https://v.redd.it/zi5oualykcg31,False,False,False,False
9f4fb6,A piece I did to commemorate the end of my python course. I was told you lot might enjoy!,0,25,TheHouseofReps,2018-09-12 03:56:32,https://i.redd.it/9idgk79odql11.jpg,False,False,False,False
ti7uyh,I teach python for middle and high schoolers – I made this little trophy for a competition of who could make the best image using Turtle/Python,0,79,Early-Palpitation-39,2022-03-19 23:31:44,https://www.reddit.com/r/Python/comments/ti7uyh/i_teach_python_for_middle_and_high_schoolers_i/,False,False,False,False
nao3cf,"I built a solar-powered crypto ""mining rig"" using a Raspberry Pi and Python",0,39,roblauer,2021-05-12 13:00:22,https://www.reddit.com/r/Python/comments/nao3cf/i_built_a_solarpowered_crypto_mining_rig_using_a/,False,False,False,False
g3j55j,Managed to write a minimal Facebook video downloader in 32 lines of code (not including comments and blank spaces),0,96,None,2020-04-18 06:46:09,https://i.redd.it/kztler8yvit41.gif,False,False,False,False
8f61xl,Flask 1.0 released,0,58,occams--chainsaw,2018-04-26 20:50:25,https://www.palletsprojects.com/blog/flask-1-0-released/,False,False,False,False
iwdzzx,Why have I not been using f-strings...,0,226,linuxfarmer,2020-09-20 13:37:57,https://www.reddit.com/r/Python/comments/iwdzzx/why_have_i_not_been_using_fstrings/,False,False,False,False
idxmnt,Snake game in a single line of python,0,154,tjf314,2020-08-21 14:22:06,https://www.reddit.com/r/Python/comments/idxmnt/snake_game_in_a_single_line_of_python/,False,False,False,False
qcvvs6,Learning Python and found this great resource,0,20,A_code24,2021-10-21 16:40:28,https://www.reddit.com/r/Python/comments/qcvvs6/learning_python_and_found_this_great_resource/,False,False,False,False
cifyi7,I made an Inventory GUI,0,33,pokepetter,2019-07-27 10:28:27,https://imgur.com/e0CxJjv,False,False,False,False
gtgsot,Python performance comparison in my project's unittest (via Gitlab CI/CD),0,43,trollodel,2020-05-30 16:18:14,https://i.redd.it/d433sa3ffx151.png,False,False,False,False
a6wufg,Python is now the programming language with most questions in StackOverFlow per month.,0,106,katakoria,2018-12-17 05:17:57,https://insights.stackoverflow.com/trends?tags=java%2Cc%2Cc%2B%2B%2Cpython%2Cc%23%2Cvb.net%2Cjavascript%2Cassembly%2Cphp%2Cperl%2Cruby%2Cvb%2Cswift%2Cr%2Cobjective-c,False,False,False,False
7x7izl,I did a meme,0,115,None,2018-02-13 06:25:54,https://imgur.com/a/LOl46,False,False,False,False
12nxsop,"Google announces the list of 574 Python packages in its new ""Assured Open Source Software"" service",0,104,ankmahato,2023-04-16 06:09:23,https://cloud.google.com/assured-open-source-software/docs/supported-packages#python,False,False,False,False
uqabuy,Web Scraping with Python: Everything you need to know to get started (2022),0,43,japaget,2022-05-15 16:58:56,https://www.scrapingbee.com/blog/web-scraping-101-with-python/,False,False,False,False
eu5zb4,I wrote simple converter image to ascii(again?) and render it into picture.(source code in comments),0,50,simpleman112244,2020-01-26 12:13:38,https://i.redd.it/jdb05fy174d41.png,False,False,False,False
v1rde4,What's a Python feature that is very powerful but not many people use or know about it?,0,505,Far_Pineapple770,2022-05-31 14:20:28,https://www.reddit.com/r/Python/comments/v1rde4/whats_a_python_feature_that_is_very_powerful_but/,False,False,False,False
u6bcgc,Why do people still pay and use matlab having python numpy and matplotlib?,0,286,Kurisuchina,2022-04-18 11:54:34,https://www.reddit.com/r/Python/comments/u6bcgc/why_do_people_still_pay_and_use_matlab_having/,False,False,False,False
3zv0p1,"""Learn Python"" Overtakes ""Learn Java"" on Google Trends",0,118,omoser,2016-01-07 10:56:48,https://dzone.com/articles/learn-python-overtakes-learn-java,False,False,False,False
k3awea,I have created a new Python package for web scraping and analysis of stock market data.,0,40,AL8I,2020-11-29 15:11:47,https://pypi.org/project/marketools/,False,False,False,False
opeb83,Strange Attractors (My first package on pip),0,16,None,2021-07-22 13:56:00,https://www.reddit.com/r/Python/comments/opeb83/strange_attractors_my_first_package_on_pip/,False,False,False,False
11gvo6m,Python 3.12: A Game-Changer in Performance and Efficiency,0,141,srlee_b,2023-03-03 08:38:56,https://python.plainenglish.io/python-3-12-a-game-changer-in-performance-and-efficiency-8dfaaa1e744c,False,False,False,False
zqpnm5,Normally I teach Python as a CS professor. Now I’m developing a programming game where you can apply your Python skills to different coding challenges.,0,109,this_is_max,2022-12-20 14:15:29,https://www.reddit.com/r/Python/comments/zqpnm5/normally_i_teach_python_as_a_cs_professor_now_im/,False,False,False,False
pawqhw,SQLModel: SQL DBs based on Python type hints. The biggest thing I've built since FastAPI and Typer. 😅,0,152,tiangolo,2021-08-24 21:27:07,https://www.reddit.com/r/Python/comments/pawqhw/sqlmodel_sql_dbs_based_on_python_type_hints_the/,False,False,False,False
p0ffe2,"I'm the author of Rich and Textual, two highly starred Python projects on Github. AMA",0,113,willm,2021-08-08 14:16:51,https://www.reddit.com/r/Python/comments/p0ffe2/im_the_author_of_rich_and_textual_two_highly/,False,False,False,False
75slcp,Python is the 2nd most popular language on GitHub,0,84,chillysurfer,2017-10-11 22:15:21,https://i.imgur.com/KpbiDkV.png,False,False,False,False
b50i67,Used os and turtle to create visual file tree of system files (x86),0,88,None,2019-03-24 19:40:27,https://i.redd.it/fpovjx30e4o21.jpg,False,False,False,False
mkpifc,"How I Calculated the 1,000,000th Fibonacci Number with Python",0,99,1Blademaster,2021-04-05 17:05:43,https://kushm.medium.com/how-i-calculated-the-1-000-000th-fibonacci-number-with-python-e921d3642dbf,False,False,False,False
id6dq7,I wrote a script to monitor COVID cases in a specific country and send travel recommendation to WhatsApp (less than 50 lines of Python),0,71,andheroe12,2020-08-20 08:21:47,https://www.reddit.com/r/Python/comments/id6dq7/i_wrote_a_script_to_monitor_covid_cases_in_a/,False,False,False,False
9nxnm7,Looking for educational images,0,62,clone290595,2018-10-13 21:59:21,https://i.redd.it/le2rlwe3z0s11.jpg,False,False,False,False
6n9kbj,"100 Python books, categorized and ranked",0,44,figurelover,2017-07-14 15:00:55,http://pythonbooks.org/,False,False,False,False
b8xk3a,I wrote a Python package to do adaptive sampling of functions in parallel [OC],0,49,basnijholt,2019-04-03 12:52:22,https://i.redd.it/urzt7b3aq1q21.gif,False,False,False,False
11ts1qq,Why use classes?,0,133,JamzTyson,2023-03-17 14:05:12,https://www.reddit.com/r/Python/comments/11ts1qq/why_use_classes/,False,False,False,False
